### ISSUE TITLE
OTA example hangs midway

### ISSUE THREAD

**Issue by eightdot** [espressif/esp-idf#614]
The OTA example hangs midway recieving the image,

at that point it also stops responding to ping and arp, 

then (after some time)  looses wifi connection, and cannot reconnect

with [*] Run FreeRTOS only on first core  selected it works

hardware:
Ai-Thinker 	ESP-32S Breakout Board
also happens on custom board

build steps:
`mkdir ~/proj && cd ~/proj && mkdir esp32 && cd esp32`
`wget https://dl.espressif.com/dl/xtensa-esp32-elf-linux64-1.22.0-61-gab8375a-5.2.0.tar.gz`
`tar -xzf xtensa-esp32-elf-linux64-1.22.0-61-gab8375a-5.2.0.tar.gz`
`export PATH=$PATH:$HOME/proj/esp32/xtensa-esp32-elf/bin`
`git clone https://github.com/espressif/esp-idf `
`cd esp-idf/`
`git submodule update --init`
`export IDF_PATH=~/proj/esp32/esp-idf`
`cd .. && cp -r esp-idf/examples/system/ota ota && cd ota`
`make flash`
`stty -F /dev/ttyUSB0 115200 min 1 && cat /dev/ttyUSB0`

config changes:
> CONFIG_WIFI_SSID="tdwb"
> CONFIG_WIFI_PASSWORD="qwertyuiop"
> CONFIG_SERVER_IP="172.29.29.1"

git details
esp-idf: commit 1ddf40feb73386df26ac51bd80aac2210229b164 
Submodule path 'components/aws_iot/aws-iot-device-sdk-embedded-C': checked out '7132505b00d2dd57f48478e75efa636021919aae'
Submodule path 'components/bt/lib': checked out 'cbdf2b94b13a9e7df47c83a45fb82c71ba718f7c'
Submodule path 'components/coap/libcoap': checked out '6468887a12666f88b8704d797fc176cd4f40ee4c'
Submodule path 'components/esp32/lib': checked out '0c6d1e05a127dc1fef7c7b66d5ebf7c14111a77a'
Submodule path 'components/esptool_py/esptool': checked out '96698a3da9acc6e357741663830f97524b688ade'
Submodule path 'components/micro-ecc/micro-ecc': checked out '14222e062d77f45321676e813d9525f32a88e8fa'

**Comment by eightdot** [comment]
log (hit reset after 1st try):

rst:0x1 (POWERON_RESET),boot:0x13 (SPI_FAST_FLASH_BOOT)
configsip: 0, SPIWP:0x00
clk_drv:0x00,q_drv:0x00,d_drv:0x00,cs0_drv:0x00,hd_drv:0x00,wp_drv:0x00
mode:DIO, clock div:2
load:0x3fff0008,len:8
load:0x3fff0010,len:4404
load:0x40078000,len:11092
load:0x40080000,len:252
entry 0x40080034
I (44) boot: ESP-IDF v2.0-rc1-813-g1ddf40fe 2nd stage bootloader
I (45) boot: compile time 10:19:05
I (78) boot: Enabling RNG early entropy source...
I (79) boot: SPI Speed      : 40MHz
I (79) boot: SPI Mode       : DIO
I (87) boot: SPI Flash Size : 4MB
I (100) boot: Partition Table:
I (111) boot: ## Label            Usage          Type ST Offset   Length
I (134) boot:  0 nvs              WiFi data        01 02 00009000 00004000
I (157) boot:  1 otadata          OTA data         01 00 0000d000 00002000
I (180) boot:  2 phy_init         RF data          01 01 0000f000 00001000
I (204) boot:  3 factory          factory app      00 00 00010000 00100000
I (227) boot:  4 ota_0            OTA app          00 10 00110000 00100000
I (250) boot:  5 ota_1            OTA app          00 11 00210000 00100000
I (273) boot: End of partition table
I (287) boot: Disabling RNG early entropy source...
I (304) boot: Loading app partition at offset 00010000
I (1004) boot: segment 0: paddr=0x00010018 vaddr=0x00000000 size=0x0ffe8 ( 65512) 
I (1004) boot: segment 1: paddr=0x00020008 vaddr=0x3f400010 size=0x09d70 ( 40304) map
I (1021) boot: segment 2: paddr=0x00029d80 vaddr=0x3ffb0000 size=0x02af8 ( 11000) load
I (1052) boot: segment 3: paddr=0x0002c880 vaddr=0x40080000 size=0x00400 (  1024) load
I (1074) boot: segment 4: paddr=0x0002cc88 vaddr=0x40080400 size=0x13324 ( 78628) load
I (1138) boot: segment 5: paddr=0x0003ffb4 vaddr=0x400c0000 size=0x00000 (     0) load
I (1139) boot: segment 6: paddr=0x0003ffbc vaddr=0x00000000 size=0x0004c (    76) 
I (1159) boot: segment 7: paddr=0x00040010 vaddr=0x400d0018 size=0x47220 (291360) map
I (1185) cpu_start: Pro cpu up.
I (1196) cpu_start: Starting app cpu, entry point is 0x40080e60
I (0) cpu_start: App cpu up.
I (1229) heap_alloc_caps: Initializing. RAM available for dynamic allocation:
I (1252) heap_alloc_caps: At 3FFAE2A0 len 00001D60 (7 KiB): DRAM
I (1272) heap_alloc_caps: At 3FFB8408 len 00027BF8 (158 KiB): DRAM
I (1293) heap_alloc_caps: At 3FFE0440 len 00003BC0 (14 KiB): D/IRAM
I (1315) heap_alloc_caps: At 3FFE4350 len 0001BCB0 (111 KiB): D/IRAM
I (1336) heap_alloc_caps: At 40093724 len 0000C8DC (50 KiB): IRAM
I (1357) cpu_start: Pro cpu start user code
I (1415) cpu_start: Starting scheduler on PRO CPU.
I (202) cpu_start: Starting scheduler on APP CPU.
I (272) wifi: wifi firmware version: 6c86a1c
I (272) wifi: config NVS flash: enabled
I (272) wifi: config nano formating: disabled
I (272) system_api: Base MAC address is not set, read default base MAC address from BLK0 of EFUSE
I (282) system_api: Base MAC address is not set, read default base MAC address from BLK0 of EFUSE
I (312) wifi: Init dynamic tx buffer num: 32
I (312) wifi: Init dynamic rx buffer num: 32
I (312) wifi: wifi driver task: 3ffbce00, prio:23, stack:4096
I (322) wifi: Init static rx buffer num: 10
I (322) wifi: Init dynamic rx buffer num: 32
I (322) wifi: Init rx ampdu len mblock:7
I (332) wifi: Init lldesc rx ampdu entry mblock:4
I (332) wifi: wifi power manager task: 0x3ffc3904 prio: 21 stack: 2560
I (342) ota: Setting WiFi configuration SSID tdwb...
I (342) wifi: wifi timer task: 3ffc496c, prio:22, stack:3584
W (352) phy_init: failed to load RF calibration data (0x1102), falling back to full calibration
I (522) phy: phy_version: 350, Mar 22 2017, 15:02:06, 0, 2
I (532) wifi: mode : sta (24:0a:c4:01:c1:44)
I (532) ota: Starting OTA example...
I (532) ota: Running partition type 0 subtype 0 (offset 0x00010000)
I (1252) wifi: n:6 0, o:1 0, ap:255 255, sta:6 0, prof:1
I (2232) wifi: state: init -> auth (b0)
I (2242) wifi: state: auth -> assoc (0)
I (2252) wifi: state: assoc -> run (10)
I (2272) wifi: connected with tdwb, channel 6
I (4742) event: ip: 172.29.29.113, mask: 255.255.255.0, gw: 172.29.29.1
I (4742) ota: Connect to Wifi ! Start to Connect to Server....
I (4742) ota: Server IP: 172.29.29.1 Server Port:8070
I (4752) ota: Connected to server
I (4762) ota: Connected to http server
I (4762) ota: Send GET request to server succeeded
I (4762) ota: Writing to partition subtype 16 at offset 0x110000
I (4922) ota: esp_ota_begin succeeded
I (8022) wifi: pm start, type:0

I (50662) ota: esp_ota_write header OK
I (50662) ota: Have written image length 1274
I (50672) ota: Have written image length 2298
I (50672) ota: Have written image length 3322
I (50682) ota: Have written image length 4194
I (50692) ota: Have written image length 5218
I (50692) ota: Have written image length 6242
I (50692) ota: Have written image length 7114
I (50692) ota: Have written image length 8138
I (50702) ota: Have written image length 8574
I (50702) ota: Have written image length 9598
I (50702) ota: Have written image length 10034
I (50702) ota: Have written image length 11058
I (50702) ota: Have written image length 11494
I (50702) ota: Have written image length 12518
I (50702) ota: Have written image length 13542
I (50712) ota: Have written image length 14566
I (50722) ota: Have written image length 15590
I (50722) ota: Have written image length 15874
I (50742) ota: Have written image length 16898
I (50752) ota: Have written image length 17334



ets Jun  8 2016 00:22:57

rst:0x1 (POWERON_RESET),boot:0x13 (SPI_FAST_FLASH_BOOT)
configsip: 0, SPIWP:0x00
clk_drv:0x00,q_drv:0x00,d_drv:0x00,cs0_drv:0x00,hd_drv:0x00,wp_drv:0x00
mode:DIO, clock div:2
load:0x3fff0008,len:8
load:0x3fff0010,len:4404
load:0x40078000,len:11092
load:0x40080000,len:252
entry 0x40080034
I (44) boot: ESP-IDF v2.0-rc1-813-g1ddf40fe 2nd stage bootloader
I (44) boot: compile time 10:19:05
I (78) boot: Enabling RNG early entropy source...
I (78) boot: SPI Speed      : 40MHz
I (79) boot: SPI Mode       : DIO
I (87) boot: SPI Flash Size : 4MB
I (100) boot: Partition Table:
I (111) boot: ## Label            Usage          Type ST Offset   Length
I (134) boot:  0 nvs              WiFi data        01 02 00009000 00004000
I (157) boot:  1 otadata          OTA data         01 00 0000d000 00002000
I (180) boot:  2 phy_init         RF data          01 01 0000f000 00001000
I (203) boot:  3 factory          factory app      00 00 00010000 00100000
I (227) boot:  4 ota_0            OTA app          00 10 00110000 00100000
I (250) boot:  5 ota_1            OTA app          00 11 00210000 00100000
I (273) boot: End of partition table
I (286) boot: Disabling RNG early entropy source...
I (303) boot: Loading app partition at offset 00010000
I (1003) boot: segment 0: paddr=0x00010018 vaddr=0x00000000 size=0x0ffe8 ( 65512) 
I (1004) boot: segment 1: paddr=0x00020008 vaddr=0x3f400010 size=0x09d70 ( 40304) map
I (1020) boot: segment 2: paddr=0x00029d80 vaddr=0x3ffb0000 size=0x02af8 ( 11000) load
I (1051) boot: segment 3: paddr=0x0002c880 vaddr=0x40080000 size=0x00400 (  1024) load
I (1074) boot: segment 4: paddr=0x0002cc88 vaddr=0x40080400 size=0x13324 ( 78628) load
I (1137) boot: segment 5: paddr=0x0003ffb4 vaddr=0x400c0000 size=0x00000 (     0) load
I (1138) boot: segment 6: paddr=0x0003ffbc vaddr=0x00000000 size=0x0004c (    76) 
I (1158) boot: segment 7: paddr=0x00040010 vaddr=0x400d0018 size=0x47220 (291360) map
I (1185) cpu_start: Pro cpu up.
I (1196) cpu_start: Starting app cpu, entry point is 0x40080e60
I (0) cpu_start: App cpu up.
I (1229) heap_alloc_caps: Initializing. RAM available for dynamic allocation:
I (1251) heap_alloc_caps: At 3FFAE2A0 len 00001D60 (7 KiB): DRAM
I (1272) heap_alloc_caps: At 3FFB8408 len 00027BF8 (158 KiB): DRAM
I (1293) heap_alloc_caps: At 3FFE0440 len 00003BC0 (14 KiB): D/IRAM
I (1314) heap_alloc_caps: At 3FFE4350 len 0001BCB0 (111 KiB): D/IRAM
I (1336) heap_alloc_caps: At 40093724 len 0000C8DC (50 KiB): IRAM
I (1357) cpu_start: Pro cpu start user code
I (1415) cpu_start: Starting scheduler on PRO CPU.
I (202) cpu_start: Starting scheduler on APP CPU.
I (242) wifi: wifi firmware version: 6c86a1c
I (242) wifi: config NVS flash: enabled
I (242) wifi: config nano formating: disabled
I (242) system_api: Base MAC address is not set, read default base MAC address from BLK0 of EFUSE
I (252) system_api: Base MAC address is not set, read default base MAC address from BLK0 of EFUSE
I (292) wifi: Init dynamic tx buffer num: 32
I (292) wifi: Init dynamic rx buffer num: 32
I (292) wifi: wifi driver task: 3ffbe5e4, prio:23, stack:4096
I (292) wifi: Init static rx buffer num: 10
I (292) wifi: Init dynamic rx buffer num: 32
I (302) wifi: Init rx ampdu len mblock:7
I (302) wifi: Init lldesc rx ampdu entry mblock:4
I (312) wifi: wifi power manager task: 0x3ffc39ac prio: 21 stack: 2560
I (312) ota: Setting WiFi configuration SSID tdwb...
I (322) wifi: wifi timer task: 3ffc4a2c, prio:22, stack:3584
I (352) phy: phy_version: 350, Mar 22 2017, 15:02:06, 0, 0
I (352) wifi: mode : sta (24:0a:c4:01:c1:44)
I (352) ota: Starting OTA example...
I (352) ota: Running partition type 0 subtype 0 (offset 0x00010000)
I (1082) wifi: n:6 0, o:1 0, ap:255 255, sta:6 0, prof:1
I (2062) wifi: state: init -> auth (b0)
I (2062) wifi: state: auth -> assoc (0)
I (2072) wifi: state: assoc -> run (10)
I (2092) wifi: connected with tdwb, channel 6
I (3742) event: ip: 172.29.29.113, mask: 255.255.255.0, gw: 172.29.29.1
I (3742) ota: Connect to Wifi ! Start to Connect to Server....
I (3742) ota: Server IP: 172.29.29.1 Server Port:8070
I (3762) ota: Connected to server
I (3762) ota: Connected to http server
I (3762) ota: Send GET request to server succeeded
I (3762) ota: Writing to partition subtype 16 at offset 0x110000
I (3932) ota: esp_ota_begin succeeded
I (7812) wifi: pm start, type:0

I (8732) ota: esp_ota_write header OK
I (8732) ota: Have written image length 1274
I (8742) ota: Have written image length 2298
I (8742) ota: Have written image length 3322
I (8742) ota: Have written image length 4194
I (8742) ota: Have written image length 5218
I (8742) ota: Have written image length 6242
I (8762) ota: Have written image length 7266
I (8762) ota: Have written image length 8290
I (8762) ota: Have written image length 9314
I (8762) ota: Have written image length 10338
I (8772) ota: Have written image length 11362
I (8772) ota: Have written image length 11494
I (8772) ota: Have written image length 12518
I (8772) ota: Have written image length 13542
I (8772) ota: Have written image length 14566
I (8772) ota: Have written image length 15590
I (8772) ota: Have written image length 15874
I (8772) ota: Have written image length 16898
I (8772) ota: Have written image length 17922
I (8782) ota: Have written image length 18794
I (8782) ota: Have written image length 19818
I (8782) ota: Have written image length 20254
I (8782) ota: Have written image length 21278
I (8792) ota: Have written image length 22302
I (8792) ota: Have written image length 23326
I (8792) ota: Have written image length 24350
I (8792) ota: Have written image length 24634
I (8802) ota: Have written image length 25658
I (8802) ota: Have written image length 26094
I (8802) ota: Have written image length 27118
I (8802) ota: Have written image length 27554
I (8802) ota: Have written image length 28578
I (8802) ota: Have written image length 29602
I (8802) ota: Have written image length 30474
I (8802) ota: Have written image length 31498
I (8812) ota: Have written image length 32522
I (8812) ota: Have written image length 33546
I (8812) ota: Have written image length 34570
I (8812) ota: Have written image length 35594
I (8832) ota: Have written image length 36314
I (8832) ota: Have written image length 37338
I (8832) ota: Have written image length 37774

after a long time:

I (454702) wifi: state: run -> auth (3c0)
I (454702) wifi: pm stop, total sleep time: 0/448390486

I (454702) wifi: n:6 0, o:6 0, ap:255 255, sta:6 0, prof:1
I (454702) ota: Connection closed, all packets received
I (454712) ota: Total Write binary data length : 37774
E (454762) esp_image: invalid segment length 0xffffffff
E (454762) ota: esp_ota_end failed!
E (454762) ota: Exiting task due to fatal error...
I (454792) wifi: n:6 0, o:6 0, ap:255 255, sta:6 0, prof:1
I (454792) wifi: state: auth -> auth (b0)
I (454802) wifi: state: auth -> assoc (0)
I (454812) wifi: state: assoc -> run (10)
I (457922) wifi: state: run -> auth (3c0)
I (457922) wifi: n:6 0, o:6 0, ap:255 255, sta:6 0, prof:1
I (458042) wifi: n:6 0, o:6 0, ap:255 255, sta:6 0, prof:1
I (458042) wifi: state: auth -> auth (b0)
I (458042) wifi: state: auth -> assoc (0)
I (458052) wifi: state: assoc -> run (10)
I (461162) wifi: state: run -> auth (3c0)
I (461162) wifi: n:6 0, o:6 0, ap:255 255, sta:6 0, prof:1
I (461282) wifi: n:6 0, o:6 0, ap:255 255, sta:6 0, prof:1
I (461282) wifi: state: auth -> auth (b0)
I (461282) wifi: state: auth -> assoc (0)
I (461292) wifi: state: assoc -> run (10)
I (464402) wifi: state: run -> auth (3c0)

**Comment by eightdot** [comment]
tcpdump (from the wandboard that run the AP and python -m SimpleHTTPServer 8070:


10:33:21.885309 IP 172.29.29.1 > 172.29.29.113: ICMP echo request, id 6070, seq 17, length 64
10:33:21.889900 IP 172.29.29.113 > 172.29.29.1: ICMP echo reply, id 6070, seq 17, length 64
10:33:22.887336 IP 172.29.29.1 > 172.29.29.113: ICMP echo request, id 6070, seq 18, length 64
10:33:22.894390 IP 172.29.29.113 > 172.29.29.1: ICMP echo reply, id 6070, seq 18, length 64
10:33:23.112294 IP 172.29.29.1.8070 > 172.29.29.113.48644: Flags [P.], seq 1:18, ack 59, win 29200, length 17
10:33:23.114004 IP 172.29.29.1.8070 > 172.29.29.113.48644: Flags [.], seq 18:1478, ack 59, win 29200, length 1460
10:33:23.114137 IP 172.29.29.1.8070 > 172.29.29.113.48644: Flags [.], seq 1478:2938, ack 59, win 29200, length 1460
10:33:23.114218 IP 172.29.29.1.8070 > 172.29.29.113.48644: Flags [P.], seq 2938:4398, ack 59, win 29200, length 1460
10:33:23.119414 IP 172.29.29.113.48644 > 172.29.29.1.8070: Flags [R.], seq 59, ack 18, win 5840, length 0
10:33:23.132596 IP 172.29.29.113.48644 > 172.29.29.1.8070: Flags [R.], seq 59, ack 1478, win 5840, length 0
10:33:23.133180 IP 172.29.29.113.48644 > 172.29.29.1.8070: Flags [R.], seq 59, ack 2938, win 5840, length 0
10:33:23.133802 IP 172.29.29.113.48644 > 172.29.29.1.8070: Flags [R.], seq 59, ack 4398, win 5840, length 0
10:33:23.137053 IP 172.29.29.1.8070 > 172.29.29.113.57619: Flags [P.], seq 1:18, ack 59, win 29200, length 17
10:33:23.138355 IP 172.29.29.1.8070 > 172.29.29.113.57619: Flags [.], seq 18:1478, ack 59, win 29200, length 1460
10:33:23.138493 IP 172.29.29.1.8070 > 172.29.29.113.57619: Flags [.], seq 1478:2938, ack 59, win 29200, length 1460
10:33:23.138649 IP 172.29.29.1.8070 > 172.29.29.113.57619: Flags [P.], seq 2938:4398, ack 59, win 29200, length 1460
10:33:23.144114 IP 172.29.29.113.57619 > 172.29.29.1.8070: Flags [R.], seq 59, ack 18, win 5840, length 0
10:33:23.147404 IP 172.29.29.1.8070 > 172.29.29.113.13257: Flags [P.], seq 1:18, ack 59, win 29200, length 17
10:33:23.147766 IP 172.29.29.113.57619 > 172.29.29.1.8070: Flags [R.], seq 59, ack 1478, win 5840, length 0
10:33:23.148552 IP 172.29.29.113.57619 > 172.29.29.1.8070: Flags [R.], seq 59, ack 2938, win 5840, length 0
10:33:23.148895 IP 172.29.29.1.8070 > 172.29.29.113.13257: Flags [.], seq 18:1478, ack 59, win 29200, length 1460
10:33:23.148965 IP 172.29.29.113.57619 > 172.29.29.1.8070: Flags [R.], seq 59, ack 4398, win 5840, length 0
10:33:23.149084 IP 172.29.29.1.8070 > 172.29.29.113.13257: Flags [.], seq 1478:2938, ack 59, win 29200, length 1460
10:33:23.149183 IP 172.29.29.1.8070 > 172.29.29.113.13257: Flags [P.], seq 2938:4398, ack 59, win 29200, length 1460
10:33:23.156966 IP 172.29.29.113.13257 > 172.29.29.1.8070: Flags [.], ack 1478, win 4363, length 0
10:33:23.168657 IP 172.29.29.113.13257 > 172.29.29.1.8070: Flags [.], ack 1478, win 5840, length 0
10:33:23.168785 IP 172.29.29.1.8070 > 172.29.29.113.13257: Flags [.], seq 4398:5858, ack 59, win 29200, length 1460
10:33:23.168894 IP 172.29.29.1.8070 > 172.29.29.113.13257: Flags [.], seq 5858:7318, ack 59, win 29200, length 1460
10:33:23.296610 IP 172.29.29.113.13257 > 172.29.29.1.8070: Flags [.], ack 4398, win 2920, length 0
10:33:23.388561 IP 172.29.29.113.13257 > 172.29.29.1.8070: Flags [.], ack 4398, win 4968, length 0
10:33:23.388676 IP 172.29.29.1.8070 > 172.29.29.113.13257: Flags [.], seq 7318:8778, ack 59, win 29200, length 1460
10:33:23.423120 IP 172.29.29.113.13257 > 172.29.29.1.8070: Flags [.], ack 7318, win 2048, length 0
10:33:23.425134 IP 172.29.29.113.13257 > 172.29.29.1.8070: Flags [.], ack 7318, win 3944, length 0
10:33:23.425218 IP 172.29.29.1.8070 > 172.29.29.113.13257: Flags [.], seq 8778:10238, ack 59, win 29200, length 1460
10:33:23.482535 IP 172.29.29.113.13257 > 172.29.29.1.8070: Flags [.], ack 7318, win 5840, length 0
10:33:23.482646 IP 172.29.29.1.8070 > 172.29.29.113.13257: Flags [P.], seq 10238:11698, ack 59, win 29200, length 1460
10:33:23.482752 IP 172.29.29.1.8070 > 172.29.29.113.13257: Flags [.], seq 11698:13158, ack 59, win 29200, length 1460
10:33:23.544528 IP 172.29.29.113.13257 > 172.29.29.1.8070: Flags [.], ack 8778, win 5840, length 0
10:33:23.544668 IP 172.29.29.1.8070 > 172.29.29.113.13257: Flags [.], seq 13158:14618, ack 59, win 29200, length 1460
10:33:23.586494 IP 172.29.29.113.13257 > 172.29.29.1.8070: Flags [.], ack 10238, win 5840, length 0
10:33:23.586620 IP 172.29.29.1.8070 > 172.29.29.113.13257: Flags [P.], seq 14618:16078, ack 59, win 29200, length 1460
10:33:23.645385 IP 172.29.29.113.13257 > 172.29.29.1.8070: Flags [.], ack 13158, win 2920, length 0
10:33:23.691880 IP 172.29.29.113.13257 > 172.29.29.1.8070: Flags [.], ack 13158, win 4380, length 0
10:33:23.691992 IP 172.29.29.1.8070 > 172.29.29.113.13257: Flags [.], seq 16078:17538, ack 59, win 29200, length 1460
10:33:23.733235 IP 172.29.29.113.13257 > 172.29.29.1.8070: Flags [.], ack 16078, win 1460, length 0
10:33:23.889023 IP 172.29.29.1 > 172.29.29.113: ICMP echo request, id 6070, seq 19, length 64
10:33:24.210729 IP 172.29.29.1.8070 > 172.29.29.113.13257: Flags [.], seq 16078:17538, ack 59, win 29200, length 1460
10:33:24.890889 IP 172.29.29.1 > 172.29.29.113: ICMP echo request, id 6070, seq 20, length 64
10:33:25.170741 IP 172.29.29.1.8070 > 172.29.29.113.13257: Flags [.], seq 16078:17538, ack 59, win 29200, length 1460
10:33:25.890975 IP 172.29.29.1 > 172.29.29.113: ICMP echo request, id 6070, seq 21, length 64
10:33:26.890827 IP 172.29.29.1 > 172.29.29.113: ICMP echo request, id 6070, seq 22, length 64
10:33:27.090736 IP 172.29.29.1.8070 > 172.29.29.113.13257: Flags [.], seq 16078:17538, ack 59, win 29200, length 1460
10:33:27.890802 IP 172.29.29.1 > 172.29.29.113: ICMP echo request, id 6070, seq 23, length 64
10:33:28.890808 IP 172.29.29.1 > 172.29.29.113: ICMP echo request, id 6070, seq 24, length 64
10:33:29.890801 IP 172.29.29.1 > 172.29.29.113: ICMP echo request, id 6070, seq 25, length 64
10:33:30.890807 IP 172.29.29.1 > 172.29.29.113: ICMP echo request, id 6070, seq 26, length 64
10:33:30.940752 IP 172.29.29.1.8070 > 172.29.29.113.13257: Flags [.], seq 16078:17538, ack 59, win 29200, length 1460
10:33:31.890806 IP 172.29.29.1 > 172.29.29.113: ICMP echo request, id 6070, seq 27, length 64
10:33:32.890791 IP 172.29.29.1 > 172.29.29.113: ICMP echo request, id 6070, seq 28, length 64
10:33:33.890798 IP 172.29.29.1 > 172.29.29.113: ICMP echo request, id 6070, seq 29, length 64
10:33:34.890813 IP 172.29.29.1 > 172.29.29.113: ICMP echo request, id 6070, seq 30, length 64
10:33:35.890802 IP 172.29.29.1 > 172.29.29.113: ICMP echo request, id 6070, seq 31, length 64
10:33:36.890808 IP 172.29.29.1 > 172.29.29.113: ICMP echo request, id 6070, seq 32, length 64
10:33:37.890787 IP 172.29.29.1 > 172.29.29.113: ICMP echo request, id 6070, seq 33, length 64
10:33:38.640764 IP 172.29.29.1.8070 > 172.29.29.113.13257: Flags [.], seq 16078:17538, ack 59, win 29200, length 1460
10:33:38.890813 IP 172.29.29.1 > 172.29.29.113: ICMP echo request, id 6070, seq 34, length 64
10:33:39.890796 IP 172.29.29.1 > 172.29.29.113: ICMP echo request, id 6070, seq 35, length 64
10:33:39.902784 42:2c:f4:ae:1d:3f (oui Unknown) > 40:2c:f4:ae:1d:3f (oui Unknown), ethertype Unknown (0x886c), length 74:
        0x0000:  8001 0068 0000 1018 0001 0002 0000 0000  ...h............
        0x0010:  0014 0000 0002 0000 0000 0000 0000 0000  ................
        0x0020:  0000 240a c401 c144 776c 3000 0000 0000  ..$....Dwl0.....
        0x0030:  0000 0000 0000 0000 0000 0000            ............
10:33:40.890807 IP 172.29.29.1 > 172.29.29.113: ICMP echo request, id 6070, seq 36, length 64
10:33:40.922181 42:2c:f4:ae:1d:3f (oui Unknown) > 40:2c:f4:ae:1d:3f (oui Unknown), ethertype Unknown (0x886c), length 74:
        0x0000:  8001 0068 0000 1018 0001 0002 0000 0000  ...h............
        0x0010:  0014 0000 0002 0000 0000 0000 0000 0000  ................
        0x0020:  0000 240a c401 c144 776c 3000 0000 0000  ..$....Dwl0.....
        0x0030:  0000 0000 0000 0000 0000 0000            ............
10:33:41.890800 IP 172.29.29.1 > 172.29.29.113: ICMP echo request, id 6070, seq 37, length 64
10:33:41.952187 42:2c:f4:ae:1d:3f (oui Unknown) > 40:2c:f4:ae:1d:3f (oui Unknown), ethertype Unknown (0x886c), length 74:
        0x0000:  8001 0068 0000 1018 0001 0002 0000 0000  ...h............
        0x0010:  0014 0000 0002 0000 0000 0000 0000 0000  ................
        0x0020:  0000 240a c401 c144 776c 3000 0000 0000  ..$....Dwl0.....
        0x0030:  0000 0000 0000 0000 0000 0000            ............
10:33:42.890803 IP 172.29.29.1 > 172.29.29.113: ICMP echo request, id 6070, seq 38, length 64
10:33:43.130335 42:2c:f4:ae:1d:3f (oui Unknown) > 40:2c:f4:ae:1d:3f (oui Unknown), ethertype Unknown (0x886c), length 146:
        0x0000:  8001 00b0 0000 1018 0001 0002 0000 0000  ................
        0x0010:  0008 0000 0000 0000 0000 0000 0000 0000  ................
        0x0020:  0048 240a c401 c144 776c 3000 0000 0000  .H$....Dwl0.....
        0x0030:  0000 0000 0000 0000 0000 0004 7464 7762  ............tdwb
        0x0040:  0108 8b96 8284 0c18 3060 3014 0100 000f  ........0`0.....
        0x0050:  ac04 0100 000f ac04 0100 000f ac02 0000  ................
        0x0060:  3204 6c12 2448 2d1a 6e11 1eff 0000 0000  2.l.$H-.n.......
        0x0070:  0000 0000 0000 0001 0000 0000 0000 0000  ................
        0x0080:  0000 0000                                ....
10:33:43.133942 EAPOL key (3) v2, len 95
10:33:43.140762 EAPOL key (3) v1, len 117
10:33:43.143225 42:2c:f4:ae:1d:3f (oui Unknown) > 40:2c:f4:ae:1d:3f (oui Unknown), ethertype Unknown (0x886c), length 195:
        0x0000:  8001 00e1 0000 1018 0001 0002 0000 0000  ................
        0x0010:  0019 0000 0000 0000 0000 0000 0000 0000  ................
        0x0020:  0079 240a c401 c144 776c 3000 0000 0000  .y$....Dwl0.....
        0x0030:  0000 0000 0000 0000 0000 0103 0075 0201  .............u..
        0x0040:  0a00 0000 0000 0000 0000 033b cea5 a580  ...........;....
        0x0050:  b349 41e2 c4aa d812 9e8b 7427 f041 2cf5  .IA.......t'.A,.
        0x0060:  4862 b94c 9098 2c51 d439 9000 0000 0000  Hb.L..,Q.9......
        0x0070:  0000 0000 0000 0000 0000 0000 0000 0000  ................
        0x0080:  0000 0000 0000 0000 0000 00ad f538 49be  .............8I.
        0x0090:  b38f 0182 7611 a090 b985 e600 1630 1401  ....v........0..
        0x00a0:  0000 0fac 0401 0000 0fac 0401 0000 0fac  ................
        0x00b0:  0200 0000 00                             .....
10:33:43.144508 EAPOL key (3) v2, len 151
10:33:43.154298 EAPOL key (3) v1, len 95
10:33:43.155272 42:2c:f4:ae:1d:3f (oui Unknown) > 40:2c:f4:ae:1d:3f (oui Unknown), ethertype Unknown (0x886c), length 173:
        0x0000:  8001 00cb 0000 1018 0001 0002 0000 0000  ................
        0x0010:  0019 0000 0000 0000 0000 0000 0000 0000  ................
        0x0020:  0063 240a c401 c144 776c 3000 0000 0000  .c$....Dwl0.....
        0x0030:  0000 0000 0000 0000 0000 0103 005f 0203  ............._..
        0x0040:  0a00 0000 0000 0000 0000 0400 0000 0000  ................
        0x0050:  0000 0000 0000 0000 0000 0000 0000 0000  ................
        0x0060:  0000 0000 0000 0000 0000 0000 0000 0000  ................
        0x0070:  0000 0000 0000 0000 0000 0000 0000 0000  ................
        0x0080:  0000 0000 0000 0000 0000 006b 58d2 74a1  ...........kX.t.
        0x0090:  0f1b 6794 bedf 286e 861f 1e00 0000 00    ..g...(n.......
10:33:43.160211 IP 0.0.0.0.bootpc > 255.255.255.255.bootps: BOOTP/DHCP, Request from 24:0a:c4:01:c1:44 (oui Unknown), length 308
10:33:43.160768 IP 172.29.29.1 > 172.29.29.113: ICMP echo request, id 4165, seq 0, length 28
10:33:43.305947 IP 0.0.0.0.bootpc > 255.255.255.255.bootps: BOOTP/DHCP, Request from 24:0a:c4:01:c1:44 (oui Unknown), length 308
10:33:43.890791 IP 172.29.29.1 > 172.29.29.113: ICMP echo request, id 6070, seq 39, length 64
10:33:44.162030 IP 172.29.29.1.bootps > 172.29.29.113.bootpc: BOOTP/DHCP, Reply, length 300
10:33:44.172389 IP 0.0.0.0.bootpc > 255.255.255.255.bootps: BOOTP/DHCP, Request from 24:0a:c4:01:c1:44 (oui Unknown), length 308
10:33:44.173009 IP 172.29.29.1.bootps > 172.29.29.113.bootpc: BOOTP/DHCP, Reply, length 300
10:33:44.183374 ARP, Request who-has 172.29.29.113 tell 0.0.0.0, length 28
10:33:44.301673 ARP, Request who-has 172.29.29.113 tell 0.0.0.0, length 28
10:33:44.302908 ARP, Request who-has 172.29.29.113 tell 0.0.0.0, length 28
10:33:44.801860 ARP, Request who-has 172.29.29.113 tell 172.29.29.113, length 28
10:33:44.812363 ARP, Request who-has 172.29.29.1 tell 172.29.29.113, length 28
10:33:44.812428 ARP, Reply 172.29.29.1 is-at 40:2c:f4:ae:1d:3f (oui Unknown), length 28
10:33:44.817209 IP 172.29.29.113.40979 > 172.29.29.1.8070: Flags [S], seq 6509, win 5840, options [mss 1460], length 0
10:33:44.817330 IP 172.29.29.1.8070 > 172.29.29.113.40979: Flags [S.], seq 2097896751, ack 6510, win 29200, options [mss 1460], length 0
10:33:44.823445 IP 172.29.29.113.40979 > 172.29.29.1.8070: Flags [.], ack 1, win 5840, length 0
10:33:44.824363 IP 172.29.29.113.40979 > 172.29.29.1.8070: Flags [P.], seq 1:59, ack 1, win 5840, length 58
10:33:44.824443 IP 172.29.29.1.8070 > 172.29.29.113.40979: Flags [.], ack 59, win 29200, length 0
10:33:44.890796 IP 172.29.29.1 > 172.29.29.113: ICMP echo request, id 6070, seq 40, length 64
10:33:45.890773 IP 172.29.29.1 > 172.29.29.113: ICMP echo request, id 6070, seq 41, length 64
10:33:45.908565 42:2c:f4:ae:1d:3f (oui Unknown) > 40:2c:f4:ae:1d:3f (oui Unknown), ethertype Unknown (0x886c), length 74:
        0x0000:  8001 0068 0000 1018 0001 0002 0000 0000  ...h............
        0x0010:  0014 0000 0002 0000 0000 0000 0000 0000  ................
        0x0020:  0000 240a c401 c144 776c 3000 0000 0000  ..$....Dwl0.....
        0x0030:  0000 0000 0000 0000 0000 0000            ............
10:33:46.890797 IP 172.29.29.1 > 172.29.29.113: ICMP echo request, id 6070, seq 42, length 64
10:33:46.934525 42:2c:f4:ae:1d:3f (oui Unknown) > 40:2c:f4:ae:1d:3f (oui Unknown), ethertype Unknown (0x886c), length 74:
        0x0000:  8001 0068 0000 1018 0001 0002 0000 0000  ...h............
        0x0010:  0014 0000 0002 0000 0000 0000 0000 0000  ................
        0x0020:  0000 240a c401 c144 776c 3000 0000 0000  ..$....Dwl0.....
        0x0030:  0000 0000 0000 0000 0000 0000            ............
10:33:47.890801 IP 172.29.29.1 > 172.29.29.113: ICMP echo request, id 6070, seq 43, length 64
10:33:47.938810 42:2c:f4:ae:1d:3f (oui Unknown) > 40:2c:f4:ae:1d:3f (oui Unknown), ethertype Unknown (0x886c), length 74:
        0x0000:  8001 0068 0000 1018 0001 0002 0000 0000  ...h............
        0x0010:  0014 0000 0002 0000 0000 0000 0000 0000  ................
        0x0020:  0000 240a c401 c144 776c 3000 0000 0000  ..$....Dwl0.....
        0x0030:  0000 0000 0000 0000 0000 0000            ............
10:33:48.890812 IP 172.29.29.1 > 172.29.29.113: ICMP echo request, id 6070, seq 44, length 64
10:33:48.941887 42:2c:f4:ae:1d:3f (oui Unknown) > 40:2c:f4:ae:1d:3f (oui Unknown), ethertype Unknown (0x886c), length 74:
        0x0000:  8001 0068 0000 1018 0001 0002 0000 0000  ...h............
        0x0010:  0014 0000 0002 0000 0000 0000 0000 0000  ................
        0x0020:  0000 240a c401 c144 776c 3000 0000 0000  ..$....Dwl0.....
        0x0030:  0000 0000 0000 0000 0000 0000            ............
10:33:49.263073 IP 172.29.29.113 > 172.29.29.1: ICMP echo reply, id 6070, seq 40, length 64
10:33:49.641743 ARP, Request who-has 172.29.29.113 tell 172.29.29.113, length 28
10:33:49.891181 IP 172.29.29.1 > 172.29.29.113: ICMP echo request, id 6070, seq 45, length 64
10:33:49.897951 IP 172.29.29.113 > 172.29.29.1: ICMP echo reply, id 6070, seq 45, length 64
10:33:50.601446 ARP, Request who-has 172.29.29.113 tell 172.29.29.113, length 28
10:33:50.892413 IP 172.29.29.1 > 172.29.29.113: ICMP echo request, id 6070, seq 46, length 64
10:33:50.899360 IP 172.29.29.113 > 172.29.29.1: ICMP echo reply, id 6070, seq 46, length 64
10:33:51.561388 ARP, Request who-has 172.29.29.113 tell 172.29.29.113, length 28
10:33:51.894003 IP 172.29.29.1 > 172.29.29.113: ICMP echo request, id 6070, seq 47, length 64
10:33:51.899983 IP 172.29.29.113 > 172.29.29.1: ICMP echo reply, id 6070, seq 47, length 64
10:33:52.895171 IP 172.29.29.1 > 172.29.29.113: ICMP echo request, id 6070, seq 48, length 64
10:33:52.898380 IP 172.29.29.113 > 172.29.29.1: ICMP echo reply, id 6070, seq 48, length 64
10:33:53.896344 IP 172.29.29.1 > 172.29.29.113: ICMP echo request, id 6070, seq 49, length 64
10:33:53.899749 IP 172.29.29.113 > 172.29.29.1: ICMP echo reply, id 6070, seq 49, length 64
10:33:54.040742 IP 172.29.29.1.8070 > 172.29.29.113.13257: Flags [.], seq 16078:17538, ack 59, win 29200, length 1460
10:33:54.046316 IP 172.29.29.113.13257 > 172.29.29.1.8070: Flags [R.], seq 59, ack 17538, win 5840, length 0
10:33:54.049320 IP 172.29.29.1.8070 > 172.29.29.113.40979: Flags [P.], seq 1:18, ack 59, win 29200, length 17
10:33:54.050804 IP 172.29.29.1.8070 > 172.29.29.113.40979: Flags [.], seq 18:1478, ack 59, win 29200, length 1460
10:33:54.050926 IP 172.29.29.1.8070 > 172.29.29.113.40979: Flags [.], seq 1478:2938, ack 59, win 29200, length 1460
10:33:54.051071 IP 172.29.29.1.8070 > 172.29.29.113.40979: Flags [P.], seq 2938:4398, ack 59, win 29200, length 1460
10:33:54.058256 IP 172.29.29.113.40979 > 172.29.29.1.8070: Flags [.], ack 1478, win 4363, length 0
10:33:54.060390 IP 172.29.29.113.40979 > 172.29.29.1.8070: Flags [.], ack 1478, win 5840, length 0
10:33:54.060497 IP 172.29.29.1.8070 > 172.29.29.113.40979: Flags [.], seq 4398:5858, ack 59, win 29200, length 1460
10:33:54.060599 IP 172.29.29.1.8070 > 172.29.29.113.40979: Flags [.], seq 5858:7318, ack 59, win 29200, length 1460
10:33:54.071020 IP 172.29.29.113.40979 > 172.29.29.1.8070: Flags [.], ack 4398, win 2920, length 0
10:33:54.071474 IP 172.29.29.113.40979 > 172.29.29.1.8070: Flags [.], ack 7318, win 0, length 0
10:33:54.164291 IP 172.29.29.113.40979 > 172.29.29.1.8070: Flags [.], ack 7318, win 2048, length 0
10:33:54.164400 IP 172.29.29.1.8070 > 172.29.29.113.40979: Flags [.], seq 7318:8778, ack 59, win 29200, length 1460
10:33:54.245103 IP 172.29.29.113.40979 > 172.29.29.1.8070: Flags [.], ack 7318, win 3944, length 0
10:33:54.245216 IP 172.29.29.1.8070 > 172.29.29.113.40979: Flags [.], seq 8778:10238, ack 59, win 29200, length 1460
10:33:54.336628 IP 172.29.29.113.40979 > 172.29.29.1.8070: Flags [.], ack 8778, win 4532, length 0
10:33:54.336755 IP 172.29.29.1.8070 > 172.29.29.113.40979: Flags [P.], seq 10238:11698, ack 59, win 29200, length 1460
10:33:54.336861 IP 172.29.29.1.8070 > 172.29.29.113.40979: Flags [.], seq 11698:13158, ack 59, win 29200, length 1460
10:33:54.430198 IP 172.29.29.113.40979 > 172.29.29.1.8070: Flags [.], ack 10238, win 5120, length 0
10:33:54.430324 IP 172.29.29.1.8070 > 172.29.29.113.40979: Flags [.], seq 13158:14618, ack 59, win 29200, length 1460
10:33:54.475221 IP 172.29.29.113.40979 > 172.29.29.1.8070: Flags [.], ack 13158, win 2200, length 0
10:33:54.524506 IP 172.29.29.113.40979 > 172.29.29.1.8070: Flags [.], ack 13158, win 4248, length 0
10:33:54.524615 IP 172.29.29.1.8070 > 172.29.29.113.40979: Flags [P.], seq 14618:16078, ack 59, win 29200, length 1460
10:33:54.621928 IP 172.29.29.113.40979 > 172.29.29.1.8070: Flags [.], ack 14618, win 4968, length 0
10:33:54.622050 IP 172.29.29.1.8070 > 172.29.29.113.40979: Flags [.], seq 16078:17538, ack 59, win 29200, length 1460
10:33:54.622153 IP 172.29.29.1.8070 > 172.29.29.113.40979: Flags [.], seq 17538:18998, ack 59, win 29200, length 1460
10:33:54.764964 IP 172.29.29.113.40979 > 172.29.29.1.8070: Flags [.], ack 16078, win 5556, length 0
10:33:54.765088 IP 172.29.29.1.8070 > 172.29.29.113.40979: Flags [P.], seq 18998:20458, ack 59, win 29200, length 1460
10:33:54.765559 IP 172.29.29.113.40979 > 172.29.29.1.8070: Flags [.], ack 18998, win 2636, length 0
10:33:54.892927 IP 172.29.29.113.40979 > 172.29.29.1.8070: Flags [.], ack 18998, win 4968, length 0
10:33:54.893037 IP 172.29.29.1.8070 > 172.29.29.113.40979: Flags [.], seq 20458:21918, ack 59, win 29200, length 1460
10:33:54.893144 IP 172.29.29.1.8070 > 172.29.29.113.40979: Flags [.], seq 21918:23378, ack 59, win 29200, length 1460
10:33:54.898189 IP 172.29.29.1 > 172.29.29.113: ICMP echo request, id 6070, seq 50, length 64
10:33:54.902459 IP 172.29.29.113.40979 > 172.29.29.1.8070: Flags [.], ack 20458, win 5404, length 0
10:33:54.902597 IP 172.29.29.1.8070 > 172.29.29.113.40979: Flags [.], seq 23378:24838, ack 59, win 29200, length 1460
10:33:54.904999 IP 172.29.29.113.40979 > 172.29.29.1.8070: Flags [.], ack 23378, win 2484, length 0
10:33:55.042999 IP 172.29.29.113 > 172.29.29.1: ICMP echo reply, id 6070, seq 50, length 64
10:33:55.094749 IP 172.29.29.113.40979 > 172.29.29.1.8070: Flags [.], ack 23378, win 3944, length 0
10:33:55.094859 IP 172.29.29.1.8070 > 172.29.29.113.40979: Flags [.], seq 24838:26298, ack 59, win 29200, length 1460
10:33:55.095394 IP 172.29.29.113.40979 > 172.29.29.1.8070: Flags [.], ack 24838, win 4532, length 0
10:33:55.095483 IP 172.29.29.1.8070 > 172.29.29.113.40979: Flags [P.], seq 26298:27758, ack 59, win 29200, length 1460
10:33:55.095573 IP 172.29.29.1.8070 > 172.29.29.113.40979: Flags [.], seq 27758:29218, ack 59, win 29200, length 1460
10:33:55.101772 IP 172.29.29.113.40979 > 172.29.29.1.8070: Flags [.], ack 26298, win 5404, length 0
10:33:55.101880 IP 172.29.29.1.8070 > 172.29.29.113.40979: Flags [P.], seq 29218:30678, ack 59, win 29200, length 1460
10:33:55.159691 IP 172.29.29.113.40979 > 172.29.29.1.8070: Flags [.], ack 29218, win 2484, length 0
10:33:55.160146 IP 172.29.29.113.40979 > 172.29.29.1.8070: Flags [.], ack 30678, win 2484, length 0
10:33:55.160236 IP 172.29.29.1.8070 > 172.29.29.113.40979: Flags [.], seq 30678:32138, ack 59, win 29200, length 1460
10:33:55.262408 IP 172.29.29.113.40979 > 172.29.29.1.8070: Flags [.], ack 32138, win 2484, length 0
10:33:55.262535 IP 172.29.29.1.8070 > 172.29.29.113.40979: Flags [.], seq 32138:33598, ack 59, win 29200, length 1460
10:33:55.344068 IP 172.29.29.113.40979 > 172.29.29.1.8070: Flags [.], ack 32138, win 4380, length 0
10:33:55.344180 IP 172.29.29.1.8070 > 172.29.29.113.40979: Flags [.], seq 33598:35058, ack 59, win 29200, length 1460
10:33:55.344288 IP 172.29.29.1.8070 > 172.29.29.113.40979: Flags [P.], seq 35058:36518, ack 59, win 29200, length 1460
10:33:55.486374 IP 172.29.29.113.40979 > 172.29.29.1.8070: Flags [.], ack 33598, win 4968, length 0
10:33:55.486497 IP 172.29.29.1.8070 > 172.29.29.113.40979: Flags [.], seq 36518:37978, ack 59, win 29200, length 1460
10:33:55.552733 IP 172.29.29.113.40979 > 172.29.29.1.8070: Flags [.], ack 36518, win 2048, length 0
10:33:55.898244 IP 172.29.29.1 > 172.29.29.113: ICMP echo request, id 6070, seq 51, length 64
10:33:56.040741 IP 172.29.29.1.8070 > 172.29.29.113.40979: Flags [.], seq 36518:37978, ack 59, win 29200, length 1460
10:33:56.900861 IP 172.29.29.1 > 172.29.29.113: ICMP echo request, id 6070, seq 52, length 64
10:33:57.020733 IP 172.29.29.1.8070 > 172.29.29.113.40979: Flags [.], seq 36518:37978, ack 59, win 29200, length 1460
10:33:57.900789 IP 172.29.29.1 > 172.29.29.113: ICMP echo request, id 6070, seq 53, length 64
10:33:58.900789 IP 172.29.29.1 > 172.29.29.113: ICMP echo request, id 6070, seq 54, length 64
10:33:58.980733 IP 172.29.29.1.8070 > 172.29.29.113.40979: Flags [.], seq 36518:37978, ack 59, win 29200, length 1460
10:33:59.900784 IP 172.29.29.1 > 172.29.29.113: ICMP echo request, id 6070, seq 55, length 64
10:34:00.900780 IP 172.29.29.1 > 172.29.29.113: ICMP echo request, id 6070, seq 56, length 64
10:34:01.900786 IP 172.29.29.1 > 172.29.29.113: ICMP echo request, id 6070, seq 57, length 64
10:34:02.900774 IP 172.29.29.1 > 172.29.29.113: ICMP echo request, id 6070, seq 58, length 64
10:34:02.910769 IP 172.29.29.1.8070 > 172.29.29.113.40979: Flags [.], seq 36518:37978, ack 59, win 29200, length 1460
10:34:03.900783 IP 172.29.29.1 > 172.29.29.113: ICMP echo request, id 6070, seq 59, length 64
10:34:04.900785 IP 172.29.29.1 > 172.29.29.113: ICMP echo request, id 6070, seq 60, length 64
10:34:05.900784 IP 172.29.29.1 > 172.29.29.113: ICMP echo request, id 6070, seq 61, length 64
10:34:06.900782 IP 172.29.29.1 > 172.29.29.113: ICMP echo request, id 6070, seq 62, length 64
10:34:07.900784 IP 172.29.29.1 > 172.29.29.113: ICMP echo request, id 6070, seq 63, length 64
10:34:08.900783 IP 172.29.29.1 > 172.29.29.113: ICMP echo request, id 6070, seq 64, length 64
10:34:09.900783 IP 172.29.29.1 > 172.29.29.113: ICMP echo request, id 6070, seq 65, length 64
10:34:10.760770 IP 172.29.29.1.8070 > 172.29.29.113.40979: Flags [.], seq 36518:37978, ack 59, win 29200, length 1460
10:34:10.900788 IP 172.29.29.1 > 172.29.29.113: ICMP echo request, id 6070, seq 66, length 64
10:34:11.900780 IP 172.29.29.1 > 172.29.29.113: ICMP echo request, id 6070, seq 67, length 64
10:34:12.900784 IP 172.29.29.1 > 172.29.29.113: ICMP echo request, id 6070, seq 68, length 64
10:34:13.900783 IP 172.29.29.1 > 172.29.29.113: ICMP echo request, id 6070, seq 69, length 64
10:34:14.900787 IP 172.29.29.1 > 172.29.29.113: ICMP echo request, id 6070, seq 70, length 64
10:34:15.900787 IP 172.29.29.1 > 172.29.29.113: ICMP echo request, id 6070, seq 71, length 64
10:34:16.900787 IP 172.29.29.1 > 172.29.29.113: ICMP echo request, id 6070, seq 72, length 64
10:34:17.900786 IP 172.29.29.1 > 172.29.29.113: ICMP echo request, id 6070, seq 73, length 64
10:34:18.900786 IP 172.29.29.1 > 172.29.29.113: ICMP echo request, id 6070, seq 74, length 64
10:34:19.900786 IP 172.29.29.1 > 172.29.29.113: ICMP echo request, id 6070, seq 75, length 64
10:34:20.900785 IP 172.29.29.1 > 172.29.29.113: ICMP echo request, id 6070, seq 76, length 64
10:34:21.900784 IP 172.29.29.1 > 172.29.29.113: ICMP echo request, id 6070, seq 77, length 64
10:34:22.900785 IP 172.29.29.1 > 172.29.29.113: ICMP echo request, id 6070, seq 78, length 64
10:34:23.900783 IP 172.29.29.1 > 172.29.29.113: ICMP echo request, id 6070, seq 79, length 64
10:34:24.900777 IP 172.29.29.1 > 172.29.29.113: ICMP echo request, id 6070, seq 80, length 64
10:34:25.900785 IP 172.29.29.1 > 172.29.29.113: ICMP echo request, id 6070, seq 81, length 64
10:34:26.480750 IP 172.29.29.1.8070 > 172.29.29.113.40979: Flags [.], seq 36518:37978, ack 59, win 29200, length 1460
10:34:26.900797 IP 172.29.29.1 > 172.29.29.113: ICMP echo request, id 6070, seq 82, length 64
10:34:26.910737 ARP, Request who-has 172.29.29.113 tell 172.29.29.1, length 28
10:34:27.900786 IP 172.29.29.1 > 172.29.29.113: ICMP echo request, id 6070, seq 83, length 64
10:34:27.910737 ARP, Request who-has 172.29.29.113 tell 172.29.29.1, length 28
10:34:28.900783 IP 172.29.29.1 > 172.29.29.113: ICMP echo request, id 6070, seq 84, length 64
10:34:28.910744 ARP, Request who-has 172.29.29.113 tell 172.29.29.1, length 28
10:34:29.900780 IP 172.29.29.1 > 172.29.29.113: ICMP echo request, id 6070, seq 85, length 64
10:34:30.900786 ARP, Request who-has 172.29.29.113 tell 172.29.29.1, length 28
10:34:31.900716 ARP, Request who-has 172.29.29.113 tell 172.29.29.1, length 28
10:34:32.900719 ARP, Request who-has 172.29.29.113 tell 172.29.29.1, length 28

tcpdump of disconnect (different run): 

11:01:18.028286 EAPOL key (3) v2, len 127
11:01:18.529864 EAPOL key (3) v2, len 127
11:01:18.680724 ARP, Request who-has 172.29.29.113 tell 172.29.29.1, length 28
11:01:19.531582 EAPOL key (3) v2, len 127
11:01:19.680966 ARP, Request who-has 172.29.29.113 tell 172.29.29.1, length 28
11:01:20.532477 EAPOL key (3) v2, len 127
11:01:20.680720 ARP, Request who-has 172.29.29.113 tell 172.29.29.1, length 28
11:01:21.540473 42:2c:f4:ae:1d:3f (oui Unknown) > 40:2c:f4:ae:1d:3f (oui Unknown), ethertype Unknown (0x886c), length 74:
        0x0000:  8001 0068 0000 1018 0001 0002 0018 0000  ...h............
        0x0010:  0005 0000 0000 0000 0003 0000 0000 0000  ................
        0x0020:  0000 240a c401 c144 776c 3000 0000 0000  ..$....Dwl0.....
        0x0030:  0000 0000 0000 0000 0000 0000            ............
11:01:21.680760 ARP, Request who-has 172.29.29.113 tell 172.29.29.1, length 28
11:01:21.699773 42:2c:f4:ae:1d:3f (oui Unknown) > 40:2c:f4:ae:1d:3f (oui Unknown), ethertype Unknown (0x886c), length 146:
        0x0000:  8001 00b0 0000 1018 0001 0002 0000 0000  ................
        0x0010:  0008 0000 0000 0000 0000 0000 0000 0000  ................
        0x0020:  0048 240a c401 c144 776c 3000 0000 0000  .H$....Dwl0.....
        0x0030:  0000 0000 0000 0000 0000 0004 7464 7762  ............tdwb
        0x0040:  0108 8b96 8284 0c18 3060 3014 0100 000f  ........0.0.....
        0x0050:  ac04 0100 000f ac04 0100 000f ac02 0000  ................
        0x0060:  3204 6c12 2448 2d1a 6e11 1eff 0000 0000  2.l.$H-.n.......
        0x0070:  0000 0000 0000 0001 0000 0000 0000 0000  ................
        0x0080:  0000 0000                                ....
11:01:21.703530 EAPOL key (3) v2, len 95
11:01:21.804475 EAPOL key (3) v2, len 95
11:01:22.680971 ARP, Request who-has 172.29.29.113 tell 172.29.29.1, length 28
11:01:22.805030 EAPOL key (3) v2, len 95
11:01:23.680713 ARP, Request who-has 172.29.29.113 tell 172.29.29.1, length 28
11:01:23.806290 EAPOL key (3) v2, len 95
11:01:24.680727 ARP, Request who-has 172.29.29.113 tell 172.29.29.1, length 28
11:01:24.810799 42:2c:f4:ae:1d:3f (oui Unknown) > 40:2c:f4:ae:1d:3f (oui Unknown), ethertype Unknown (0x886c), length 74:
        0x0000:  8001 0068 0000 1018 0001 0002 0018 0000  ...h............
        0x0010:  0005 0000 0000 0000 0003 0000 0000 0000  ................
        0x0020:  0000 240a c401 c144 776c 3000 0000 0000  ..$....Dwl0.....
        0x0030:  0000 0000 0000 0000 0000 0000            ............
11:01:24.941849 42:2c:f4:ae:1d:3f (oui Unknown) > 40:2c:f4:ae:1d:3f (oui Unknown), ethertype Unknown (0x886c), length 146:
        0x0000:  8001 00b0 0000 1018 0001 0002 0000 0000  ................
        0x0010:  0008 0000 0000 0000 0000 0000 0000 0000  ................
        0x0020:  0048 240a c401 c144 776c 3000 0000 0000  .H$....Dwl0.....
        0x0030:  0000 0000 0000 0000 0000 0004 7464 7762  ............tdwb
        0x0040:  0108 8b96 8284 0c18 3060 3014 0100 000f  ........0.0.....
        0x0050:  ac04 0100 000f ac04 0100 000f ac02 0000  ................
        0x0060:  3204 6c12 2448 2d1a 6e11 1eff 0000 0000  2.l.$H-.n.......
        0x0070:  0000 0000 0000 0001 0000 0000 0000 0000  ................
        0x0080:  0000 0000                                ....
11:01:24.946902 EAPOL key (3) v2, len 95
11:01:25.047844 EAPOL key (3) v2, len 95
11:01:25.680971 ARP, Request who-has 172.29.29.113 tell 172.29.29.1, length 28
11:01:26.049112 EAPOL key (3) v2, len 95
11:01:26.680728 ARP, Request who-has 172.29.29.113 tell 172.29.29.1, length 28
11:01:27.050372 EAPOL key (3) v2, len 95
11:01:27.680715 ARP, Request who-has 172.29.29.113 tell 172.29.29.1, length 28
11:01:28.053957 42:2c:f4:ae:1d:3f (oui Unknown) > 40:2c:f4:ae:1d:3f (oui Unknown), ethertype Unknown (0x886c), length 74:
        0x0000:  8001 0068 0000 1018 0001 0002 0018 0000  ...h............
        0x0010:  0005 0000 0000 0000 0003 0000 0000 0000  ................
        0x0020:  0000 240a c401 c144 776c 3000 0000 0000  ..$....Dwl0.....
        0x0030:  0000 0000 0000 0000 0000 0000            ............
11:01:28.186404 42:2c:f4:ae:1d:3f (oui Unknown) > 40:2c:f4:ae:1d:3f (oui Unknown), ethertype Unknown (0x886c), length 146:
        0x0000:  8001 00b0 0000 1018 0001 0002 0000 0000  ................
        0x0010:  0008 0000 0000 0000 0000 0000 0000 0000  ................
        0x0020:  0048 240a c401 c144 776c 3000 0000 0000  .H$....Dwl0.....
        0x0030:  0000 0000 0000 0000 0000 0004 7464 7762  ............tdwb
        0x0040:  0108 8b96 8284 0c18 3060 3014 0100 000f  ........0.0.....
        0x0050:  ac04 0100 000f ac04 0100 000f ac02 0000  ................
        0x0060:  3204 6c12 2448 2d1a 6e11 1eff 0000 0000  2.l.$H-.n.......
        0x0070:  0000 0000 0000 0001 0000 0000 0000 0000  ................
        0x0080:  0000 0000                                ....
11:01:28.189917 EAPOL key (3) v2, len 95
11:01:28.290820 EAPOL key (3) v2, len 95

**Comment by negativekelvin** [comment]
https://github.com/espressif/esp-idf/issues/610

**Comment by projectgus** [comment]
Thanks for reporting this @eightdot . As @negativekelvin mentions, I think this is a duplicate of #610 - which I'm looking into right now. I'm going to close this issue, but please follow the link to #610 and click the "Subscribe" button under "Notifications" on the right, in order to get updates on that issue.

**Comment by eightdot** [comment]
ok
