### ISSUE TITLE
OpenThread Border Agent never answers MeshCoP DTLS ClientHello on the backbone interface (ESP32-C5, IDF v6.0.2) (IDFGH-18125)

### ISSUE THREAD

**Issue by jetliuzhe** [espressif/esp-idf#18963]
### Answers checklist

- [x] I have read the documentation and the issue is not addressed there.
- [x] I have updated my IDF branch (release/v6.0) to the latest version and checked that the issue is present there.
- [x] I have searched the issue tracker for a similar issue and not found a similar issue.

### IDF version

v6.0.2

### Espressif SoC revision

ESP32-C5 (revision v1.0)

### Operating System used

Linux

### How did you build your project?

Command line with idf.py

### Development Kit

Custom board (ESP32-C5-WROOM-1U, native 802.15.4 radio, Wi-Fi backbone)

### Power Supply used

USB

### What is the expected behavior?

With `CONFIG_OPENTHREAD_BORDER_ROUTER=y` and `CONFIG_OPENTHREAD_BORDER_AGENT_ENABLE=y`, the Border Agent advertises `_meshcop._udp` on the backbone link and accepts a MeshCoP DTLS connection from an external commissioner on that link, as stated in #16031 ("Thread Commissioning (MeshCoP) is supported in the SDK").

### What is the actual behavior?

The Border Agent socket is bound and reachable on the backbone interface, but it never responds to a well-formed DTLS ClientHello — not even a HelloVerifyRequest. The client retransmits and gives up.

I eliminated the usual causes before reporting:

1. **Port is correct and bound.** The library advertises `_meshcop._udp` with the real port (`bitengine.local:49154`, matching `BorderAgent---: Border Agent start listening on port 49154`). A UDP datagram to `192.168.10.43:49154` is silently absorbed, while the same probe to a control port `49999` returns ICMP port unreachable — so something is listening on 49154.

2. **Packets reach the device.** tcpdump on the backbone link, client is a MeshCoP commissioner on the same L2:

   ```
   11:49:26.365637 IP 192.168.10.72.45491 > 192.168.10.43.49154: UDP, length 417
   11:49:27.366210 IP 192.168.10.72.45491 > 192.168.10.43.49154: UDP, length 417
   11:49:29.367583 IP 192.168.10.72.45491 > 192.168.10.43.49154: UDP, length 417
   11:49:33.367809 IP 192.168.10.72.45491 > 192.168.10.43.49154: UDP, length 417
   ```

   Four ClientHello retransmissions with 1/2/4 s backoff, zero packets in return.

3. **The ClientHello is well formed and matches the expected cipher suite.** Decoded from the capture:

   - DTLS 1.2 record, handshake type 1 (ClientHello)
   - cipher suites: exactly one — `0xC0FF TLS_ECJPAKE_WITH_AES_128_CCM_8`
   - extensions: `ecjpake_kkpp` (330 bytes), `supported_groups`, `ec_point_formats`

   This matches what the Border Agent configures: `border_agent.cpp` calls `mDtlsTransport.SetPsk(pskc)`, and `SecureTransport::SetPsk()` sets `mCipherSuite = kEcjpakeWithAes128Ccm8` (`secure_transport.cpp:840`).

4. **Credentials are consistent.** The commissioner is configured with the PSKc from this device's active operational dataset (read via the REST API), same network name and extended PAN ID.

5. **Not a netif filtering issue.** `SecureTransport::Open()` defaults to `Ip6::kNetifUnspecified`, which passes the host-interface check in `Udp::SocketHandle::Matches()` (`udp6.cpp:48`), so backbone-sourced datagrams should match the socket.

6. **Not address-family related.** Replaying the captured ClientHello to the device's backbone IPv4 address and to its backbone IPv6 address both produce no response.

The device is otherwise a fully working border router: border routing is active, Thread devices are reachable from the backbone, SRP server and its advertising proxy work, and the REST API serves `/node` correctly.

### Steps to reproduce

1. Build a border router with `CONFIG_OPENTHREAD_BORDER_ROUTER=y`, `CONFIG_OPENTHREAD_BORDER_AGENT_ENABLE=y`, Wi-Fi as backbone; form a Thread network.
2. Confirm the Border Agent is listening (log line `Border Agent start listening on port <port>`) and that `_meshcop._udp` advertises that port.
3. From a host on the backbone link, connect a MeshCoP commissioner to `<device>:<port>` using the PSKc from the device's active dataset.
4. Capture UDP on that port: the ClientHello is retransmitted and never answered.

### Debug Logs

```
I (26962) OPENTHREAD:[I] BorderAgent---: Border Agent start listening on port 49154
```

(The device logs nothing further when the ClientHello arrives — no DTLS or Border Agent activity at all.)

### More Information

The commissioner side is the MeshCoP client from matter.js (`@matter/thread-br-client`), used by the Matter server for Thread topology diagnostics. It reports `connect timed out after 30000ms` and marks the border router unreachable. I am reporting it here rather than there because the ClientHello it sends looks correct per the decode above and matches the cipher suite the Border Agent configures.

Unrelated but found while investigating, in case it is useful: an application that registers `_meshcop._udp` in the mDNS component before the Border Agent starts will silently block the library's own publication, because `mdns_service_add()` rejects the duplicate:

```
E OPENTHREAD: esp_openthread_publish_meshcop_mdns(169): Failed to publish meshcop mdns service
```

The application's record then stays on the network with whatever port it used, and the error is only visible in the log. That was my own bug, now fixed by not registering the service, but a louder failure mode or a documented note might save someone else the same detour.
