### ISSUE TITLE
Ethernet example fails to obtain IP with KSZ8041 on ESP32 in ESP-IDF v5.5.1 (IDFGH-17018)

### ISSUE THREAD

**Issue by saumarh** [espressif/esp-idf#18064]
### Answers checklist.

- [x] I have read the documentation [ESP-IDF Programming Guide](https://docs.espressif.com/projects/esp-idf/en/latest/) and the issue is not addressed there.
- [x] I have updated my IDF branch (master or release) to the latest version and checked that the issue is present there.
- [x] I have searched the issue tracker for a similar issue and not found a similar issue.

### IDF version.

v5.5.1

### Operating System used.

Linux

### How did you build your project?

Command line with Make

### If you are using Windows, please specify command line type.

None

### What is the expected behavior?

The Ethernet interface should behave the same as in ESP-IDF v4.4.8:
- PHY is detected
- Link comes up
- DHCP client receives an IP address
- Network communication works (ping, ARP, etc.)

[v4.4.8.log](https://github.com/user-attachments/files/24385997/v4.4.8.log)

### What is the actual behavior?

- PHY is detected successfully:
`ksz80xx: auto detected phy KSZ8041`
- Ethernet interface is attached to the netif
- Link status reports UP
- DHCP client starts
- No IP address is obtained
- After some time, the interface reports an IP lost / timeout condition
- There are no fatal errors or crashes.

### Steps to reproduce.

Run examples/ethernet/basic on v4.4.8 - confirm it acquires an IP
```
CONFIG_ESPTOOLPY_FLASHSIZE_4MB=y
CONFIG_EXAMPLE_USE_INTERNAL_ETHERNET=y
CONFIG_EXAMPLE_ETH_PHY_KSZ8041=y
CONFIG_EXAMPLE_ETH_PHY_RST_GPIO=14
# CONFIG_EXAMPLE_USE_SPI_ETHERNET is not set
CONFIG_ETH_SPI_ETHERNET_W5500=y
# CONFIG_ESP_NETIF_TCPIP_ADAPTER_COMPATIBLE_LAYER is not set
CONFIG_LOG_DEFAULT_LEVEL_DEBUG=y

```
Run examples/ethernet/basic on v5.5.1 - does not obtain an ip
```
CONFIG_ESPTOOLPY_FLASHSIZE_4MB=y
CONFIG_EXAMPLE_ETH_PHY_KSZ80XX=y
CONFIG_EXAMPLE_ETH_PHY_RST_GPIO=14
CONFIG_GPIO_CTRL_FUNC_IN_IRAM=y
CONFIG_LOG_DEFAULT_LEVEL_VERBOSE=y
CONFIG_LOG_MASTER_LEVEL=y
```
...

### Build or installation Logs.

```plain
I (29) boot: ESP-IDF v5.5.1 2nd stage bootloader
I (29) boot: compile time Dec 25 2025 13:01:03
I (29) boot: Multicore bootloader
I (31) boot: chip revision: v3.1
I (33) boot.esp32: SPI Speed      : 40MHz
I (37) boot.esp32: SPI Mode       : DIO
I (41) boot.esp32: SPI Flash Size : 4MB
I (44) boot: Enabling RNG early entropy source...
I (49) boot: Partition Table:
I (51) boot: ## Label            Usage          Type ST Offset   Length
I (58) boot:  0 nvs              WiFi data        01 02 00009000 00006000
I (64) boot:  1 phy_init         RF data          01 01 0000f000 00001000
I (71) boot:  2 factory          factory app      00 00 00010000 00100000
I (77) boot: End of partition table
I (81) esp_image: segment 0: paddr=00010020 vaddr=3f400020 size=12bc4h ( 76740) map
I (114) esp_image: segment 1: paddr=00022bec vaddr=3ffb0000 size=02604h (  9732) load
I (118) esp_image: segment 2: paddr=000251f8 vaddr=40080000 size=0ae20h ( 44576) load
I (136) esp_image: segment 3: paddr=00030020 vaddr=400d0020 size=33520h (210208) map
I (208) esp_image: segment 4: paddr=00063548 vaddr=4008ae20 size=03110h ( 12560) load
I (213) esp_image: segment 5: paddr=00066660 vaddr=50000000 size=00020h (    32) load
I (220) boot: Loaded app from partition at offset 0x10000
I (220) boot: Disabling RNG early entropy source...
V (233) mmap: after coalescing, 3 regions are left
I (234) cpu_start: Multicore app
D (234) cpu_start: Pro cpu up
D (234) cpu_start: Starting app cpu, entry point is 0x400813c4
--- 0x400813c4: call_start_cpu1 at /home/saumar/src/esp-idf/components/esp_system/port/cpu_start.c:197
D (0) cpu_start: App cpu up
D (247) clk: RTC_SLOW_CLK calibration value: 3045414
D (258) cpu_start: calling init function: 0x400d2868 on core: 0
--- 0x400d2868: __esp_system_init_fn_init_efuse_check at /home/saumar/src/esp-idf/components/efuse/src/esp_efuse_startup.c:37
D (258) cpu_start: calling init function: 0x400d2e98 on core: 0
--- 0x400d2e98: __esp_system_init_fn_init_show_cpu_freq at /home/saumar/src/esp-idf/components/esp_system/startup_funcs.c:64
I (260) cpu_start: Pro cpu start user code
I (264) cpu_start: cpu freq: 160000000 Hz
D (268) cpu_start: calling init function: 0x400d27a8 on core: 0
--- 0x400d27a8: __esp_system_init_fn_init_show_app_info at /home/saumar/src/esp-idf/components/esp_app_format/esp_app_desc.c:123
I (273) app_init: Application information:
I (277) app_init: Project name:     ethernet_basic
I (282) app_init: App version:      v5.5.1
I (285) app_init: Compile time:     Dec 25 2025 13:01:01
I (290) app_init: ELF file SHA256:  46ce70d7f...
I (295) app_init: ESP-IDF:          v5.5.1
D (299) cpu_start: calling init function: 0x400d287c on core: 0
--- 0x400d287c: __esp_system_init_fn_init_efuse_show_app_info at /home/saumar/src/esp-idf/components/efuse/src/esp_efuse_startup.c:47
I (304) efuse_init: Min chip rev:     v0.0
I (308) efuse_init: Max chip rev:     v3.99 
I (312) efuse_init: Chip rev:         v3.1
D (316) cpu_start: calling init function: 0x400d43c0 on core: 0
--- 0x400d43c0: __esp_system_init_fn_init_heap at /home/saumar/src/esp-idf/components/heap/heap_caps_init.c:26
V (322) memory_layout: reserved range is 0x3f412b0c - 0x3f412b54
D (327) memory_layout: Checking 9 reserved memory ranges:
D (332) memory_layout: Reserved memory range 0x3ff82000 - 0x3ff82000
D (338) memory_layout: Reserved memory range 0x3ffae000 - 0x3ffae6e0
D (345) memory_layout: Reserved memory range 0x3ffb0000 - 0x3ffb38f0
D (351) memory_layout: Reserved memory range 0x3ffe0000 - 0x3ffe0440
D (357) memory_layout: Reserved memory range 0x3ffe3f20 - 0x3ffe4350
D (363) memory_layout: Reserved memory range 0x40070000 - 0x40078000
D (369) memory_layout: Reserved memory range 0x40078000 - 0x40080000
--- 0x40080000: _WindowOverflow4 at /home/saumar/src/esp-idf/components/xtensa/xtensa_vectors.S:2027
D (375) memory_layout: Reserved memory range 0x40080000 - 0x4008df30
--- 0x40080000: _WindowOverflow4 at /home/saumar/src/esp-idf/components/xtensa/xtensa_vectors.S:2027
D (381) memory_layout: Reserved memory range 0x50001fe8 - 0x50002000
D (387) memory_layout: Building list of available memory regions:
V (393) memory_layout: Examining memory region 0x3ffae000 - 0x3ffb0000
V (399) memory_layout: Start of region 0x3ffae000 - 0x3ffb0000 overlaps reserved 0x3ffae000 - 0x3ffae6e0
D (408) memory_layout: Available memory region 0x3ffae6e0 - 0x3ffb0000
V (415) memory_layout: Examining memory region 0x3ffb0000 - 0x3ffb8000
V (421) memory_layout: Start of region 0x3ffb0000 - 0x3ffb8000 overlaps reserved 0x3ffb0000 - 0x3ffb38f0
D (430) memory_layout: Available memory region 0x3ffb38f0 - 0x3ffb8000
V (436) memory_layout: Examining memory region 0x3ffb8000 - 0x3ffc0000
D (443) memory_layout: Available memory region 0x3ffb8000 - 0x3ffc0000
V (449) memory_layout: Examining memory region 0x3ffc0000 - 0x3ffc2000
D (455) memory_layout: Available memory region 0x3ffc0000 - 0x3ffc2000
V (461) memory_layout: Examining memory region 0x3ffc2000 - 0x3ffc4000
D (468) memory_layout: Available memory region 0x3ffc2000 - 0x3ffc4000
V (474) memory_layout: Examining memory region 0x3ffc4000 - 0x3ffc6000
D (480) memory_layout: Available memory region 0x3ffc4000 - 0x3ffc6000
V (486) memory_layout: Examining memory region 0x3ffc6000 - 0x3ffc8000
D (493) memory_layout: Available memory region 0x3ffc6000 - 0x3ffc8000
V (499) memory_layout: Examining memory region 0x3ffc8000 - 0x3ffca000
D (505) memory_layout: Available memory region 0x3ffc8000 - 0x3ffca000
V (511) memory_layout: Examining memory region 0x3ffca000 - 0x3ffcc000
D (518) memory_layout: Available memory region 0x3ffca000 - 0x3ffcc000
V (524) memory_layout: Examining memory region 0x3ffcc000 - 0x3ffce000
D (530) memory_layout: Available memory region 0x3ffcc000 - 0x3ffce000
V (536) memory_layout: Examining memory region 0x3ffce000 - 0x3ffd0000
D (543) memory_layout: Available memory region 0x3ffce000 - 0x3ffd0000
V (549) memory_layout: Examining memory region 0x3ffd0000 - 0x3ffd2000
D (555) memory_layout: Available memory region 0x3ffd0000 - 0x3ffd2000
V (561) memory_layout: Examining memory region 0x3ffd2000 - 0x3ffd4000
D (568) memory_layout: Available memory region 0x3ffd2000 - 0x3ffd4000
V (574) memory_layout: Examining memory region 0x3ffd4000 - 0x3ffd6000
D (580) memory_layout: Available memory region 0x3ffd4000 - 0x3ffd6000
V (586) memory_layout: Examining memory region 0x3ffd6000 - 0x3ffd8000
D (593) memory_layout: Available memory region 0x3ffd6000 - 0x3ffd8000
V (599) memory_layout: Examining memory region 0x3ffd8000 - 0x3ffda000
D (605) memory_layout: Available memory region 0x3ffd8000 - 0x3ffda000
V (611) memory_layout: Examining memory region 0x3ffda000 - 0x3ffdc000
D (618) memory_layout: Available memory region 0x3ffda000 - 0x3ffdc000
V (624) memory_layout: Examining memory region 0x3ffdc000 - 0x3ffde000
D (630) memory_layout: Available memory region 0x3ffdc000 - 0x3ffde000
V (636) memory_layout: Examining memory region 0x3ffde000 - 0x3ffe0000
D (643) memory_layout: Available memory region 0x3ffde000 - 0x3ffe0000
V (649) memory_layout: Examining memory region 0x3ffe0000 - 0x3ffe4000
V (655) memory_layout: Start of region 0x3ffe0000 - 0x3ffe4000 overlaps reserved 0x3ffe0000 - 0x3ffe0440
V (664) memory_layout: End of region 0x3ffe0440 - 0x3ffe4000 overlaps reserved 0x3ffe3f20 - 0x3ffe4350
D (673) memory_layout: Available memory region 0x3ffe0440 - 0x3ffe3f20
V (679) memory_layout: Examining memory region 0x3ffe4000 - 0x3ffe8000
V (686) memory_layout: Start of region 0x3ffe4000 - 0x3ffe8000 overlaps reserved 0x3ffe3f20 - 0x3ffe4350
D (695) memory_layout: Available memory region 0x3ffe4350 - 0x3ffe8000
V (701) memory_layout: Examining memory region 0x3ffe8000 - 0x3fff0000
D (707) memory_layout: Available memory region 0x3ffe8000 - 0x3fff0000
V (714) memory_layout: Examining memory region 0x3fff0000 - 0x3fff8000
D (720) memory_layout: Available memory region 0x3fff0000 - 0x3fff8000
V (726) memory_layout: Examining memory region 0x3fff8000 - 0x3fffc000
D (732) memory_layout: Available memory region 0x3fff8000 - 0x3fffc000
V (739) memory_layout: Examining memory region 0x3fffc000 - 0x40000000
--- 0x40000000: _WindowOverflow4 in ROM
D (745) memory_layout: Available memory region 0x3fffc000 - 0x40000000
--- 0x40000000: _WindowOverflow4 in ROM
V (751) memory_layout: Examining memory region 0x40070000 - 0x40078000
V (757) memory_layout: Region 0x40070000 - 0x40078000 inside of reserved 0x40070000 - 0x40078000
V (766) memory_layout: Examining memory region 0x40078000 - 0x40080000
--- 0x40080000: _WindowOverflow4 at /home/saumar/src/esp-idf/components/xtensa/xtensa_vectors.S:2027
V (772) memory_layout: Region 0x40078000 - 0x40080000 inside of reserved 0x40078000 - 0x40080000
--- 0x40080000: _WindowOverflow4 at /home/saumar/src/esp-idf/components/xtensa/xtensa_vectors.S:2027
--- 0x40080000: _WindowOverflow4 at /home/saumar/src/esp-idf/components/xtensa/xtensa_vectors.S:2027
V (781) memory_layout: Examining memory region 0x40080000 - 0x40082000
--- 0x40080000: _WindowOverflow4 at /home/saumar/src/esp-idf/components/xtensa/xtensa_vectors.S:2027
--- 0x40082000: find_containing_heap at /home/saumar/src/esp-idf/components/heap/heap_private.h:78
--- (inlined by) heap_caps_free at /home/saumar/src/esp-idf/components/heap/heap_caps_base.c:79
V (787) memory_layout: Region 0x40080000 - 0x40082000 inside of reserved 0x40080000 - 0x4008df30
--- 0x40080000: _WindowOverflow4 at /home/saumar/src/esp-idf/components/xtensa/xtensa_vectors.S:2027
--- 0x40082000: find_containing_heap at /home/saumar/src/esp-idf/components/heap/heap_private.h:78
--- (inlined by) heap_caps_free at /home/saumar/src/esp-idf/components/heap/heap_caps_base.c:79
--- 0x40080000: _WindowOverflow4 at /home/saumar/src/esp-idf/components/xtensa/xtensa_vectors.S:2027
V (795) memory_layout: Examining memory region 0x40082000 - 0x40084000
--- 0x40082000: find_containing_heap at /home/saumar/src/esp-idf/components/heap/heap_private.h:78
--- (inlined by) heap_caps_free at /home/saumar/src/esp-idf/components/heap/heap_caps_base.c:79
--- 0x40084000: crosscore_int_ll_clear_interrupt at /home/saumar/src/esp-idf/components/hal/esp32/include/hal/crosscore_int_ll.h:22
--- (inlined by) esp_crosscore_isr at /home/saumar/src/esp-idf/components/esp_system/crosscore_int.c:49
V (802) memory_layout: Region 0x40082000 - 0x40084000 inside of reserved 0x40080000 - 0x4008df30
--- 0x40082000: find_containing_heap at /home/saumar/src/esp-idf/components/heap/heap_private.h:78
--- (inlined by) heap_caps_free at /home/saumar/src/esp-idf/components/heap/heap_caps_base.c:79
--- 0x40084000: crosscore_int_ll_clear_interrupt at /home/saumar/src/esp-idf/components/hal/esp32/include/hal/crosscore_int_ll.h:22
--- (inlined by) esp_crosscore_isr at /home/saumar/src/esp-idf/components/esp_system/crosscore_int.c:49
--- 0x40080000: _WindowOverflow4 at /home/saumar/src/esp-idf/components/xtensa/xtensa_vectors.S:2027
V (810) memory_layout: Examining memory region 0x40084000 - 0x40086000
--- 0x40084000: crosscore_int_ll_clear_interrupt at /home/saumar/src/esp-idf/components/hal/esp32/include/hal/crosscore_int_ll.h:22
--- (inlined by) esp_crosscore_isr at /home/saumar/src/esp-idf/components/esp_system/crosscore_int.c:49
--- 0x40086000: esp_system_reset_modules_on_exit at /home/saumar/src/esp-idf/components/esp_system/port/soc/esp32/system_internal.c:57
V (816) memory_layout: Region 0x40084000 - 0x40086000 inside of reserved 0x40080000 - 0x4008df30
--- 0x40084000: crosscore_int_ll_clear_interrupt at /home/saumar/src/esp-idf/components/hal/esp32/include/hal/crosscore_int_ll.h:22
--- (inlined by) esp_crosscore_isr at /home/saumar/src/esp-idf/components/esp_system/crosscore_int.c:49
--- 0x40086000: esp_system_reset_modules_on_exit at /home/saumar/src/esp-idf/components/esp_system/port/soc/esp32/system_internal.c:57
--- 0x40080000: _WindowOverflow4 at /home/saumar/src/esp-idf/components/xtensa/xtensa_vectors.S:2027
V (825) memory_layout: Examining memory region 0x40086000 - 0x40088000
--- 0x40086000: esp_system_reset_modules_on_exit at /home/saumar/src/esp-idf/components/esp_system/port/soc/esp32/system_internal.c:57
--- 0x40088000: xTaskCheckForTimeOut at /home/saumar/src/esp-idf/components/freertos/FreeRTOS-Kernel/tasks.c:4173
V (831) memory_layout: Region 0x40086000 - 0x40088000 inside of reserved 0x40080000 - 0x4008df30
--- 0x40086000: esp_system_reset_modules_on_exit at /home/saumar/src/esp-idf/components/esp_system/port/soc/esp32/system_internal.c:57
--- 0x40088000: xTaskCheckForTimeOut at /home/saumar/src/esp-idf/components/freertos/FreeRTOS-Kernel/tasks.c:4173
--- 0x40080000: _WindowOverflow4 at /home/saumar/src/esp-idf/components/xtensa/xtensa_vectors.S:2027
V (840) memory_layout: Examining memory region 0x40088000 - 0x4008a000
--- 0x40088000: xTaskCheckForTimeOut at /home/saumar/src/esp-idf/components/freertos/FreeRTOS-Kernel/tasks.c:4173
--- 0x4008a000: spi_flash_ll_erase_sector at /home/saumar/src/esp-idf/components/hal/esp32/include/hal/spi_flash_ll.h:101
--- (inlined by) spi_flash_hal_erase_sector at /home/saumar/src/esp-idf/components/hal/spi_flash_hal_iram.c:46
V (846) memory_layout: Region 0x40088000 - 0x4008a000 inside of reserved 0x40080000 - 0x4008df30
--- 0x40088000: xTaskCheckForTimeOut at /home/saumar/src/esp-idf/components/freertos/FreeRTOS-Kernel/tasks.c:4173
--- 0x4008a000: spi_flash_ll_erase_sector at /home/saumar/src/esp-idf/components/hal/esp32/include/hal/spi_flash_ll.h:101
--- (inlined by) spi_flash_hal_erase_sector at /home/saumar/src/esp-idf/components/hal/spi_flash_hal_iram.c:46
--- 0x40080000: _WindowOverflow4 at /home/saumar/src/esp-idf/components/xtensa/xtensa_vectors.S:2027
V (854) memory_layout: Examining memory region 0x4008a000 - 0x4008c000
--- 0x4008a000: spi_flash_ll_erase_sector at /home/saumar/src/esp-idf/components/hal/esp32/include/hal/spi_flash_ll.h:101
--- (inlined by) spi_flash_hal_erase_sector at /home/saumar/src/esp-idf/components/hal/spi_flash_hal_iram.c:46
--- 0x4008c000: abort at /home/saumar/src/esp-idf/components/newlib/src/abort.c:30
V (861) memory_layout: Region 0x4008a000 - 0x4008c000 inside of reserved 0x40080000 - 0x4008df30
--- 0x4008a000: spi_flash_ll_erase_sector at /home/saumar/src/esp-idf/components/hal/esp32/include/hal/spi_flash_ll.h:101
--- (inlined by) spi_flash_hal_erase_sector at /home/saumar/src/esp-idf/components/hal/spi_flash_hal_iram.c:46
--- 0x4008c000: abort at /home/saumar/src/esp-idf/components/newlib/src/abort.c:30
--- 0x40080000: _WindowOverflow4 at /home/saumar/src/esp-idf/components/xtensa/xtensa_vectors.S:2027
V (869) memory_layout: Examining memory region 0x4008c000 - 0x4008e000
--- 0x4008c000: abort at /home/saumar/src/esp-idf/components/newlib/src/abort.c:30
V (875) memory_layout: Start of region 0x4008c000 - 0x4008e000 overlaps reserved 0x40080000 - 0x4008df30
--- 0x4008c000: abort at /home/saumar/src/esp-idf/components/newlib/src/abort.c:30
--- 0x40080000: _WindowOverflow4 at /home/saumar/src/esp-idf/components/xtensa/xtensa_vectors.S:2027
D (885) memory_layout: Available memory region 0x4008df30 - 0x4008e000
V (891) memory_layout: Examining memory region 0x4008e000 - 0x40090000
D (897) memory_layout: Available memory region 0x4008e000 - 0x40090000
V (903) memory_layout: Examining memory region 0x40090000 - 0x40092000
D (910) memory_layout: Available memory region 0x40090000 - 0x40092000
V (916) memory_layout: Examining memory region 0x40092000 - 0x40094000
D (922) memory_layout: Available memory region 0x40092000 - 0x40094000
V (928) memory_layout: Examining memory region 0x40094000 - 0x40096000
D (935) memory_layout: Available memory region 0x40094000 - 0x40096000
V (941) memory_layout: Examining memory region 0x40096000 - 0x40098000
D (947) memory_layout: Available memory region 0x40096000 - 0x40098000
V (953) memory_layout: Examining memory region 0x40098000 - 0x4009a000
D (960) memory_layout: Available memory region 0x40098000 - 0x4009a000
V (966) memory_layout: Examining memory region 0x4009a000 - 0x4009c000
D (972) memory_layout: Available memory region 0x4009a000 - 0x4009c000
V (978) memory_layout: Examining memory region 0x4009c000 - 0x4009e000
D (985) memory_layout: Available memory region 0x4009c000 - 0x4009e000
V (991) memory_layout: Examining memory region 0x4009e000 - 0x400a0000
D (997) memory_layout: Available memory region 0x4009e000 - 0x400a0000
I (1003) heap_init: Initializing. RAM available for dynamic allocation:
D (1010) heap_init: New heap initialised at 0x3ffae6e0
I (1015) heap_init: At 3FFAE6E0 len 00001920 (6 KiB): DRAM
D (1020) heap_init: New heap initialised at 0x3ffb38f0
I (1025) heap_init: At 3FFB38F0 len 0002C710 (177 KiB): DRAM
I (1030) heap_init: At 3FFE0440 len 00003AE0 (14 KiB): D/IRAM
I (1036) heap_init: At 3FFE4350 len 0001BCB0 (111 KiB): D/IRAM
D (1041) heap_init: New heap initialised at 0x4008df30
I (1046) heap_init: At 4008DF30 len 000120D0 (72 KiB): IRAM
D (1051) cpu_start: calling init function: 0x400d26a0 on core: 0
--- 0x400d26a0: __esp_system_init_fn_esp_timer_init_nonos at /home/saumar/src/esp-idf/components/esp_timer/src/esp_timer_init.c:28
D (1057) cpu_start: calling init function: 0x400d54dc on core: 0
--- 0x400d54dc: __esp_system_init_fn_init_libc at /home/saumar/src/esp-idf/components/newlib/src/init.c:12
D (1063) cpu_start: calling init function: 0x400d2edc on core: 0
--- 0x400d2edc: __esp_system_init_fn_init_brownout at /home/saumar/src/esp-idf/components/esp_system/startup_funcs.c:79
V (1069) intr_alloc: esp_intr_alloc_intrstatus (cpu 0): checking args
V (1075) intr_alloc: esp_intr_alloc_intrstatus (cpu 0): Args okay. Resulting flags 0x40E
D (1083) intr_alloc: Connected src 46 to int 1 (cpu 0)
D (1087) cpu_start: calling init function: 0x400d2eec on core: 0
--- 0x400d2eec: __esp_system_init_fn_init_newlib_time at /home/saumar/src/esp-idf/components/esp_system/startup_funcs.c:104
D (1093) cpu_start: calling init function: 0x400d6adc on core: 0
--- 0x400d6adc: __esp_system_init_fn_init_vfs_uart at /home/saumar/src/esp-idf/components/esp_driver_uart/src/uart_vfs.c:1148
D (1099) cpu_start: calling init function: 0x400d8850 on core: 0
--- 0x400d8850: __esp_system_init_fn_init_vfs_nullfs at /home/saumar/src/esp-idf/components/vfs/nullfs.c:322
D (1105) cpu_start: calling init function: 0x400d758c on core: 0
--- 0x400d758c: __esp_system_init_fn_init_vfs_console at /home/saumar/src/esp-idf/components/esp_vfs_console/vfs_console.c:271
D (1110) cpu_start: calling init function: 0x400d54e8 on core: 0
--- 0x400d54e8: __esp_system_init_fn_init_libc_stdio at /home/saumar/src/esp-idf/components/newlib/src/init.c:18
D (1116) cpu_start: calling init function: 0x400d2ef8 on core: 0
--- 0x400d2ef8: __esp_system_init_fn_init_flash at /home/saumar/src/esp-idf/components/esp_system/startup_funcs.c:111
V (1122) memspi: raw_chip_id: 16405E

V (1125) memspi: chip_id: 5E4016

V (1128) memspi: raw_chip_id: 16405E

V (1132) memspi: chip_id: 5E4016

D (1135) spi_flash: trying chip: issi
D (1138) spi_flash: trying chip: gd
D (1141) spi_flash: trying chip: mxic
D (1145) spi_flash: trying chip: winbond
D (1149) spi_flash: trying chip: generic
I (1152) spi_flash: detected chip: generic
I (1156) spi_flash: flash io: dio
D (1159) cpu_start: calling init function: 0x400d2908 on core: 0
--- 0x400d2908: __esp_system_init_fn_init_efuse at /home/saumar/src/esp-idf/components/efuse/src/esp_efuse_startup.c:158
D (1165) cpu_start: calling init function: 0x400e1b28
--- 0x400e1b28: esp_clock_output_pin_ctrl_init at /home/saumar/src/esp-idf/components/esp_hw_support/esp_clock_output.c:245
D (1170) cpu_start: calling init function: 0x40085774
--- 0x40085774: enable_timer_group0_for_calibration at /home/saumar/src/esp-idf/components/esp_hw_support/port/esp32/rtc_time.c:199
D (1174) cpu_start: calling init function: 0x400d3b58
--- 0x400d3b58: esp_ipc_init at /home/saumar/src/esp-idf/components/esp_system/esp_ipc.c:107
D (1179) cpu_start: calling init function: 0x400dee90 on core: 0
--- 0x400dee90: __esp_system_init_fn_esp_timer_init_os at /home/saumar/src/esp-idf/components/esp_timer/src/esp_timer.c:566
V (1185) intr_alloc: esp_intr_alloc_intrstatus (cpu 0): checking args
V (1191) intr_alloc: esp_intr_alloc_intrstatus (cpu 0): Args okay. Resulting flags 0xC02
D (1199) intr_alloc: Connected src 17 to int 2 (cpu 0)
D (1204) cpu_start: calling init function: 0x400ffe5c on core: 0
--- 0x400ffe5c: __esp_system_init_fn_esp_security_init at /home/saumar/src/esp-idf/components/esp_security/src/init.c:42
D (1209) cpu_start: calling init function: 0x400d2f28 on core: 0
--- 0x400d2f28: __esp_system_init_fn_init_disable_rtc_wdt at /home/saumar/src/esp-idf/components/esp_system/startup_funcs.c:179
V (1215) intr_alloc: esp_intr_alloc_intrstatus (cpu 0): checking args
V (1221) intr_alloc: esp_intr_alloc_intrstatus (cpu 0): Args okay. Resulting flags 0x40E
D (1229) intr_alloc: Connected src 24 to int 3 (cpu 0)
D (1234) app_start: Starting scheduler on CPU0
V (1238) intr_alloc: esp_intr_alloc_intrstatus (cpu 1): checking args
V (1238) intr_alloc: esp_intr_alloc_intrstatus (cpu 1): Args okay. Resulting flags 0x40E
I (D (1248) intr_alloc: Connected src 25 to int 1 (cpu 1)
D (1248) app_start: Starting scheduler on CPU1
1238) main_task: Started on CPU0
D (1268) heap_init: New heap initialised at 0x3ffe0440
D (1268) heap_init: New heap initialised at 0x3ffe4350
V (1268) intr_alloc: esp_intr_alloc_intrstatus (cpu 0): checking args
V (1278) intr_alloc: esp_intr_alloc_intrstatus (cpu 0): Args okay. Resulting flags 0xE
D (1278) intr_alloc: Connected src 16 to int 5 (cpu 0)
I (1288) main_task: Calling app_main()
V (1288) intr_alloc: esp_intr_alloc_intrstatus (cpu 0): checking args
V (1298) intr_alloc: esp_intr_alloc_intrstatus (cpu 0): Args okay. Resulting flags 0xE
D (1308) intr_alloc: Connected src 38 to int 8 (cpu 0)
D (1318) efuse: BLK0 REG2 [8-15], len=8 bits
D (1318) efuse: BLK0 REG2 [0-7], len=8 bits
D (1318) efuse: BLK0 REG1 [24-31], len=8 bits
D (1318) efuse: BLK0 REG1 [16-23], len=8 bits
D (1328) efuse: BLK0 REG1 [8-15], len=8 bits
D (1328) efuse: BLK0 REG1 [0-7], len=8 bits
D (1338) efuse: BLK0 REG2 [16-23], len=8 bits
I (1358) ksz80xx: auto detected phy KSZ8041
D (1358) esp_eth: new ethernet driver @0x3ffba6d8
D (1358) esp_netif_lwip: LwIP stack has been initialized
D (1358) esp_netif_lwip: esp-netif has been successfully initialized
D (1358) event: running task for loop 0x3ffbb9bc
D (1368) event: created task for loop 0x3ffbb9bc
D (1368) event: created event loop 0x3ffbb9bc
D (1378) esp_netif_lwip: check: remote, if=0x3ffb5b10 fn=0x400e2b68
--- 0x400e2b68: esp_netif_new_api at /home/saumar/src/esp-idf/components/esp_netif/lwip/esp_netif_lwip.c:769
V (1378) esp_netif_objects: esp_netif_add_to_list_unsafe 0x3ffbc8fc
D (1388) esp_netif_objects: esp_netif_add_to_list_unsafe netif added successfully (total netifs: 1)
D (1398) esp_netif_lwip: call api in lwip: ret=0x0, give sem
I (1398) esp_eth.netif.netif_glue: 20:43:a8:61:bf:3b
D (1408) esp_netif_lwip: check: remote, if=0x3ffbc8fc fn=0x400e2324
--- 0x400e2324: esp_netif_set_mac_api at /home/saumar/src/esp-idf/components/esp_netif/lwip/esp_netif_lwip.c:1086
D (1408) esp_netif_lwip: call api in lwip: ret=0x0, give sem
I (1418) esp_eth.netif.netif_glue: ethernet attached to netif
D (3418) event: running post ETH_EVENT:0 with handler 0x400da490 and context 0x3ffbcb28 on loop 0x3ffbb9bc
--- 0x400da490: eth_action_start at /home/saumar/src/esp-idf/components/esp_eth/src/esp_eth_netif_glue.c:91
D (3418) esp_eth.netif.netif_glue: eth_action_start: 0x3ffbcad0, 0x3f40460c, 0, 0x3ffbcc70, 0x3ffba6d8
D (3418) esp_netif_handlers: esp_netif action has started with netif0x3ffbc8fc from event_id=0
D (3428) esp_netif_lwip: check: remote, if=0x3ffbc8fc fn=0x400e2d64
--- 0x400e2d64: esp_netif_start_api at /home/saumar/src/esp-idf/components/esp_netif/lwip/esp_netif_lwip.c:1161
D (3438) esp_netif_lwip: esp_netif_start_api 0x3ffbc8fc
D (3438) esp.emac: working in 100Mbps
D (3438) esp_netif_lwip: esp_netif_get_hostname esp_netif:0x3ffbc8fc
D (3448) esp_netif_lwip: call api in lwip: ret=0x0, give sem
D (3458) event: running post ETH_EVENT:0 with handler 0x400d8928 and context 0x3ffbcc30 on loop 0x3ffbb9bc
--- 0x400d8928: eth_event_handler at /home/saumar/src/esp-idf/examples/ethernet/basic/main/ethernet_example_main.c:25
I (3468) eth_example: Ethernet Started
D (3468) esp.emac: working in full duplex
D (3468) esp.emac: Flow control not enabled for the link
D (3478) esp.emac: emac started
D (3478) event: running post ETH_EVENT:2 with handler 0x400da3f0 and context 0x3ffbcb88 on loop 0x3ffbb9bc
--- 0x400da3f0: eth_action_connected at /home/saumar/src/esp-idf/components/esp_eth/src/esp_eth_netif_glue.c:111
D (3488) esp_eth.netif.netif_glue: eth_action_connected: 0x3ffbcad0, 0x3f40460c, 2, 0x3ffbcc70, 0x3ffba6d8
D (3498) esp_netif_handlers: esp_netif action connected with netif0x3ffbc8fc from event_id=2
D (3508) esp_netif_lwip: check: remote, if=0x3ffbc8fc fn=0x400e2f88
--- 0x400e2f88: esp_netif_up_api at /home/saumar/src/esp-idf/components/esp_netif/lwip/esp_netif_lwip.c:1808
D (3508) esp_netif_lwip: esp_netif_up_api esp_netif:0x3ffbc8fc
I (3508) main_task: Returned from app_main()
D (3518) esp_netif_lwip: call api in lwip: ret=0x0, give sem
D (3528) esp_netif_lwip: check: remote, if=0x3ffbc8fc fn=0x400e27d0
--- 0x400e27d0: esp_netif_dhcpc_start_api at /home/saumar/src/esp-idf/components/esp_netif/lwip/esp_netif_lwip.c:1600
D (3538) esp_netif_lwip: esp_netif_dhcpc_start_api esp_netif:0x3ffbc8fc
D (3538) esp_netif_lwip: esp_netif_start_ip_lost_timer esp_netif:0x3ffbc8fc
D (3548) esp_netif_lwip: if0x3ffbc8fc start ip lost tmr: interval=120
D (3548) esp_netif_lwip: starting dhcp client
D (3558) esp_netif_lwip: call api in lwip: ret=0x0, give sem
D (3558) event: running post ETH_EVENT:2 with handler 0x400d8928 and context 0x3ffbcc30 on loop 0x3ffbb9bc
--- 0x400d8928: eth_event_handler at /home/saumar/src/esp-idf/examples/ethernet/basic/main/ethernet_example_main.c:25
I (3568) eth_example: Ethernet Link Up
I (3578) eth_example: Ethernet HW Addr 20:43:a8:61:bf:3b
D (123548) esp_netif_lwip: esp_netif_ip_lost_timer esp_netif:0x3ffbc8fc
D (123548) esp_netif_lwip: check: local, if=0x3ffbc8fc fn=0x400e33a8
--- 0x400e33a8: esp_netif_update_default_netif_lwip at /home/saumar/src/esp-idf/components/esp_netif/lwip/esp_netif_lwip.c:313
D (123548) esp_netif_lwip: esp_netif_update_default_netif_lwip 0x3ffbc8fc
V (123548) esp_netif_objects: esp_netif_next_unsafe 0x0
V (123558) esp_netif_lwip: esp_netif_is_netif_up esp_netif:0x3ffbc8fc
V (123558) esp_netif_objects: esp_netif_next_unsafe 0x3ffbc8fc
V (123568) esp_netif_lwip: esp_netif_is_netif_up esp_netif:0x3ffbc8fc
D (123578) esp_netif_lwip: if0x3ffbc8fc ip lost tmr: raise ip lost event
D (123578) event: no handlers have been registered for event IP_EVENT:5 posted to loop 0x3ffbb9bc
```

### More Information.

- Chip: WROOM-32UE
- The issue is reproducible and deterministic on our custom hardware.
- Hardware has been validated in production with ESP-IDF v4.4.x.
- The problem was observed when migrating three firmware versions from 4.4.7 to the current stable release (5.5.1).

**Comment by kostaond** [comment]
Hi @saumarh, thank you for reporting potential issue. Could you please configure DHCP server on your Linux PC if you use router as DHCP server? Then connect the ESP32 device directly to the PC and capture Ethernet traffic using Wireshark or similar tool. Do you see any DHCP request issued by ESP32?

**Comment by saumarh** [comment]
Hi @kostaond please see below:

4.4.8:
```
$ sudo dnsmasq -C /etc/dnsmasq-test.conf --no-daemon
dnsmasq: started, version 2.90 cachesize 150
dnsmasq: compile time options: IPv6 GNU-getopt DBus no-UBus i18n IDN2 DHCP DHCPv6 no-Lua TFTP conntrack ipset no-nftset auth cryptohash DNSSEC loop-detect inotify dumpfile
dnsmasq-dhcp: DHCP, IP range 192.168.1.250 -- 192.168.1.253, lease time 1d
dnsmasq-dhcp: DHCP, sockets bound exclusively to interface enp12s0
dnsmasq: using nameserver 8.8.8.8#53
dnsmasq: using nameserver 1.1.1.1#53
dnsmasq: read /etc/hosts - 17 names
dnsmasq-dhcp: 4242258475 available DHCP range: 192.168.1.250 -- 192.168.1.253
dnsmasq-dhcp: 4242258475 client provides name: espressif
dnsmasq-dhcp: 4242258475 DHCPDISCOVER(enp12s0) 02:11:22:33:44:58 
dnsmasq-dhcp: 4242258475 tags: enp12s0
dnsmasq-dhcp: 4242258475 DHCPOFFER(enp12s0) 192.168.1.250 02:11:22:33:44:58 
dnsmasq-dhcp: 4242258475 requested options: 1:netmask, 3:router, 28:broadcast, 6:dns-server
dnsmasq-dhcp: 4242258475 next server: 192.168.1.120
dnsmasq-dhcp: 4242258475 sent size:  1 option: 53 message-type  2
dnsmasq-dhcp: 4242258475 sent size:  4 option: 54 server-identifier  192.168.1.120
dnsmasq-dhcp: 4242258475 sent size:  4 option: 51 lease-time  1d
dnsmasq-dhcp: 4242258475 sent size:  4 option: 58 T1  12h
dnsmasq-dhcp: 4242258475 sent size:  4 option: 59 T2  21h
dnsmasq-dhcp: 4242258475 sent size:  4 option:  1 netmask  255.255.255.0
dnsmasq-dhcp: 4242258475 sent size:  4 option: 28 broadcast  192.168.1.255
dnsmasq-dhcp: 4242258475 sent size:  8 option:  6 dns-server  8.8.8.8, 1.1.1.1
dnsmasq-dhcp: 4242258475 sent size:  4 option:  3 router  192.168.1.120
dnsmasq-dhcp: 4242258475 available DHCP range: 192.168.1.250 -- 192.168.1.253
dnsmasq-dhcp: 4242258475 client provides name: espressif
dnsmasq-dhcp: 4242258475 DHCPREQUEST(enp12s0) 192.168.1.250 02:11:22:33:44:58 
dnsmasq-dhcp: 4242258475 tags: enp12s0
dnsmasq-dhcp: 4242258475 DHCPACK(enp12s0) 192.168.1.250 02:11:22:33:44:58 espressif
dnsmasq-dhcp: 4242258475 requested options: 1:netmask, 3:router, 28:broadcast, 6:dns-server
dnsmasq-dhcp: 4242258475 next server: 192.168.1.120
dnsmasq-dhcp: 4242258475 sent size:  1 option: 53 message-type  5
dnsmasq-dhcp: 4242258475 sent size:  4 option: 54 server-identifier  192.168.1.120
dnsmasq-dhcp: 4242258475 sent size:  4 option: 51 lease-time  1d
dnsmasq-dhcp: 4242258475 sent size:  4 option: 58 T1  12h
dnsmasq-dhcp: 4242258475 sent size:  4 option: 59 T2  21h
dnsmasq-dhcp: 4242258475 sent size:  4 option:  1 netmask  255.255.255.0
dnsmasq-dhcp: 4242258475 sent size:  4 option: 28 broadcast  192.168.1.255
dnsmasq-dhcp: 4242258475 sent size:  8 option:  6 dns-server  8.8.8.8, 1.1.1.1
dnsmasq-dhcp: 4242258475 sent size:  4 option:  3 router  192.168.1.120

```
```
$ sudo tcpdump -i any -n port 67 or port 68
tcpdump: data link type LINUX_SLL2
tcpdump: verbose output suppressed, use -v[v]... for full protocol decode
listening on any, link-type LINUX_SLL2 (Linux cooked v2), snapshot length 262144 bytes
15:11:47.802494 enp12s0 B   IP 0.0.0.0.68 > 255.255.255.255.67: BOOTP/DHCP, Request from 02:11:22:33:44:58, length 308
15:11:47.803144 enp12s0 Out IP 192.168.1.120.67 > 192.168.1.250.68: BOOTP/DHCP, Reply, length 300
15:11:47.811810 enp12s0 B   IP 0.0.0.0.68 > 255.255.255.255.67: BOOTP/DHCP, Request from 02:11:22:33:44:58, length 308
15:11:47.820100 enp12s0 Out IP 192.168.1.120.67 > 192.168.1.250.68: BOOTP/DHCP, Reply, length 300
```

```
$ idf.py monitor
...
I (3986) eth_example: Ethernet Got IP Address
I (3996) eth_example: ~~~~~~~~~~~
I (3996) eth_example: ETHIP:192.168.1.250
I (4006) eth_example: ETHMASK:255.255.255.0
I (4006) eth_example: ETHGW:192.168.1.120
I (4006) eth_example: ~~~~~~~~~~~
```

v5.5.2:
```
$ sudo dnsmasq -C /etc/dnsmasq-test.conf --no-daemon
dnsmasq: started, version 2.90 cachesize 150
dnsmasq: compile time options: IPv6 GNU-getopt DBus no-UBus i18n IDN2 DHCP DHCPv6 no-Lua TFTP conntrack ipset no-nftset auth cryptohash DNSSEC loop-detect inotify dumpfile
dnsmasq-dhcp: DHCP, IP range 192.168.1.250 -- 192.168.1.253, lease time 1d
dnsmasq-dhcp: DHCP, sockets bound exclusively to interface enp12s0
dnsmasq: using nameserver 8.8.8.8#53
dnsmasq: using nameserver 1.1.1.1#53
dnsmasq: read /etc/hosts - 17 names
Silence...
```

```
$ sudo tcpdump -i any -n port 67 or port 68
tcpdump: data link type LINUX_SLL2
tcpdump: verbose output suppressed, use -v[v]... for full protocol decode
listening on any, link-type LINUX_SLL2 (Linux cooked v2), snapshot length 262144 bytes
Silence...
```

```
$ idf.py monitor
...
I (2365) eth_example: Ethernet Link Up
I (2365) eth_example: Ethernet HW Addr 20:43:a8:61:bf:3b
Just like the logs in the opening ticket.
```

**Comment by kostaond** [comment]
@saumarh that is strange... Could you please try to run [PHY tester tool](https://github.com/espressif/esp-eth-drivers/tree/master/phy_tester) and let me know the output? Start with running the `pytest` but you can also experiment with its console commands.

**Comment by saumarh** [comment]
@kostaond I flashed the phy tester tool
```
eth_phy> phy info
--- PHY Chip under Test ---
Name: KSZ80XX
MCD pin: 23
MDIO pin: 18
eth_phy> loop-server
I (2095518) ethernet_init: Ethernet(KSZ80XX[23,18]) Started
E (2105518) eth_phy_test_fncs: loop_server(220): link connect timeout
I (2105518) ethernet_init: Ethernet(KSZ80XX[23,18]) Stopped
eth_phy> loop-test
I (2108098) ethernet_init: Ethernet(KSZ80XX[23,18]) Started
D (2108098) esp.emac: working in 100Mbps
D (2108108) esp.emac: working in half duplex [ -- NOTE: I messed with options it while testing ]
D (2108108) esp.emac: Flow control not enabled for the link
D (2108118) esp.emac: emac started
I (2108118) ethernet_init: Ethernet(KSZ80XX[23,18]) Link Up
I (2108118) ethernet_init: Ethernet(KSZ80XX[23,18]) HW Addr 20:43:a8:61:bf:3b
I (2108128) eth_phy_test_fncs: starting ETH broadcast transmissions with Ethertype: 0x3300
I (2119238) eth_phy_test_fncs: TXed frames: 10, looped frames: 0, RX errors: 0
D (2119238) esp.emac: emac stopped
I (2119238) ethernet_init: Ethernet(KSZ80XX[23,18]) Link Down
I (2119248) ethernet_init: Ethernet(KSZ80XX[23,18]) Stopped
eth_phy> 
```

```
$ python3 test_eth_phy.py --eth_nic enp12s0 dummy-tx
/home/saumar/.espressif/python_env/idf6.1_py3.10_env/lib/python3.10/site-packages/scapy/layers/ipsec.py:512: CryptographyDeprecationWarning: TripleDES has been moved to cryptography.hazmat.decrepit.ciphers.algorithms.TripleDES and will be removed from cryptography.hazmat.primitives.ciphers.algorithms in 48.0.0.
  cipher=algorithms.TripleDES,
/home/saumar/.espressif/python_env/idf6.1_py3.10_env/lib/python3.10/site-packages/scapy/layers/ipsec.py:516: CryptographyDeprecationWarning: TripleDES has been moved to cryptography.hazmat.decrepit.ciphers.algorithms.TripleDES and will be removed from cryptography.hazmat.primitives.ciphers.algorithms in 48.0.0.
  cipher=algorithms.TripleDES,
2026-01-14 16:23:03,233 detected interfaces: ['br-a93090b6142a', 'docker0', 'virbr0', 'wlp0s20f3', 'enp12s0', 'veth15cae7d', 'br-3cb8c82df7b8', 'lo', 'veth2980ffa']
2026-01-14 16:23:03,233 Use enp12s0 for testing
nothing else...
```

Would you please specify which tests I would need to perform?

**Comment by kostaond** [comment]
Please follow the instructions in README.md and try to run the `pytest`. If you were not able to run it for some reason, please try execute `loop-test` from the console at least.

**Comment by kostaond** [comment]
Ou I see, you did run the `loop-test` but why EMAC is in half duplex? PHY loopack (near-end) doesn't work in half duplex.

**Comment by saumarh** [comment]
I commented in the logs: [ -- NOTE: I messed with options while testing ]
but before I set it to half-duplex the output was the same for loop-test

**Comment by saumarh** [comment]
full-duplex:
```
eth_phy> loop-test
I (20022648) ethernet_init: Ethernet(KSZ80XX[23,18]) Started
D (20024648) esp.emac: working in 100Mbps
D (20024648) esp.emac: working in full duplex
D (20024648) esp.emac: Flow control not enabled for the link
D (20024648) esp.emac: emac started
I (20024658) ethernet_init: Ethernet(KSZ80XX[23,18]) Link Up
I (20024658) ethernet_init: Ethernet(KSZ80XX[23,18]) HW Addr 20:43:a8:61:bf:3b
I (20024678) eth_phy_test_fncs: starting ETH broadcast transmissions with Ethertype: 0x3300
I (20035778) eth_phy_test_fncs: TXed frames: 10, looped frames: 0, RX errors: 0
D (20035778) esp.emac: emac stopped
I (20035778) ethernet_init: Ethernet(KSZ80XX[23,18]) Link Down
I (20035788) ethernet_init: Ethernet(KSZ80XX[23,18]) Stopped
```

**Comment by kostaond** [comment]
Were you able to run the full set of tests using the `pytest`?

**Comment by saumarh** [comment]
First I ran `sudo setcap 'CAP_NET_RAW+eip' $(readlink -f $(which python))`

pytest was not available and `install.sh --enable-pytest` (master):
```
ERROR: The following selected features are not valid: pytest
```
So I pip installed pytest and then ran `install.sh ---enable-test-specific`

Running pytest as documented gives me an error:
```
$ pytest -s --embedded-services esp,idf --tb=no --add-target-as-marker y -m esp32 --eth-nic enp12s0
ERROR: usage: pytest [options] [file_or_dir] [file_or_dir] [...]
pytest: error: unrecognized arguments: --add-target-as-marker
  inifile: /home/saumar/esp/master/esp-idf/esp-eth-drivers/phy_tester/pytest.ini
  rootdir: /home/saumar/esp/master/esp-idf/esp-eth-drivers/phy_tester
```

I can run `test_eth_phy.py` (documented as `pytest_eth_phy.py` in README) this way:
```
$ python3 test_eth_phy.py --eth_nic enp12s0 dummy-tx
/home/saumar/.espressif/python_env/idf6.1_py3.10_env/lib/python3.10/site-packages/scapy/layers/ipsec.py:512: CryptographyDeprecationWarning: TripleDES has been moved to cryptography.hazmat.decrepit.ciphers.algorithms.TripleDES and will be removed from cryptography.hazmat.primitives.ciphers.algorithms in 48.0.0.
  cipher=algorithms.TripleDES,
/home/saumar/.espressif/python_env/idf6.1_py3.10_env/lib/python3.10/site-packages/scapy/layers/ipsec.py:516: CryptographyDeprecationWarning: TripleDES has been moved to cryptography.hazmat.decrepit.ciphers.algorithms.TripleDES and will be removed from cryptography.hazmat.primitives.ciphers.algorithms in 48.0.0.
  cipher=algorithms.TripleDES,
2026-01-14 16:23:03,233 detected interfaces: ['br-a93090b6142a', 'docker0', 'virbr0', 'wlp0s20f3', 'enp12s0', 'veth15cae7d', 'br-3cb8c82df7b8', 'lo', 'veth2980ffa']
2026-01-14 16:23:03,233 Use enp12s0 for testing
```
And nothing else is printed.

Running pytest w/o arguments:
```
$ pytest
=========================================================================================== test session starts ============================================================================================
platform linux -- Python 3.10.12, pytest-9.0.2, pluggy-1.6.0
rootdir: /home/saumar/esp/master/esp-idf/esp-eth-drivers/phy_tester
configfile: pytest.ini
plugins: embedded-2.5.0
collected 2 items                                                                                                                                                                                          

test_eth_phy.py::test_esp_ethernet[esp32] 
---------------------------------------------------------------------------------------------- live log call -----------------------------------------------------------------------------------------------
INFO     root:test_eth_phy.py:65 detected interfaces: ['br-a93090b6142a', 'docker0', 'virbr0', 'wlp0s20f3', 'enp12s0', 'veth15cae7d', 'br-3cb8c82df7b8', 'lo']
INFO     root:test_eth_phy.py:78 Use enp12s0 for testing
FAILED                                                                                                                                                                                               [ 50%]
test_eth_phy.py::test_esp_ethernet[esp32p4] 
---------------------------------------------------------------------------------------------- live log call -----------------------------------------------------------------------------------------------
INFO     root:test_eth_phy.py:65 detected interfaces: ['br-a93090b6142a', 'docker0', 'virbr0', 'wlp0s20f3', 'enp12s0', 'veth15cae7d', 'br-3cb8c82df7b8', 'lo']
INFO     root:test_eth_phy.py:78 Use enp12s0 for testing
FAILED                                                                                                                                                                                               [100%]

================================================================================================= FAILURES =================================================================================================
_________________________________________________________________________________________ test_esp_ethernet[esp32] _________________________________________________________________________________________

self = <pytest_embedded.dut.Dut object at 0x70f3cacc3610>, pattern = 'Ethernet init successful!', expect_all = False, not_matching = (), return_what_before_match = False, args = (), kwargs = {}
patterns = ['Ethernet init successful!'], res = []
debug_str = 'Not found "Ethernet init successful!"\nBytes in current buffer (color code eliminated): \nPlease check the full log here: /tmp/pytest-embedded/2026-01-15_15-57-42-834444/test_esp_ethernet[esp32]/dut.log'

    @functools.wraps(func)
    def wrapper(
        self,
        pattern,
        *args,
        expect_all: bool = False,
        not_matching: list[str | re.Pattern] = (),
        return_what_before_match: bool = False,
        **kwargs,
    ) -> Match | AnyStr | list[Match | AnyStr]:
        if return_what_before_match and expect_all:
            raise ValueError('`return_what_before_match` and `expect_all` cannot be `True` at the same time.')
    
        patterns = to_list(pattern)
        res = []
        while patterns:
            try:
>               index = func(self, pattern, *args, **kwargs)

/home/saumar/.espressif/python_env/idf6.1_py3.10_env/lib/python3.10/site-packages/pytest_embedded/dut.py:86: 
_ _ _ _ _ _ _ _ _ _ _ _ _ _ _ _ _ _ _ _ _ _ _ _ _ _ _ _ _ _ _ _ _ _ _ _ _ _ _ _ _ _ _ _ _ _ _ _ _ _ _ _ _ _ _ _ _ _ _ _ _ _ _ _ _ _ _ _ _ _ _ _ _ _ _ _ _ _ _ _ _ _ _ _ _ _ _ _ _ _ _ _ _ _ _ _ _ _ _ _ _ _ 
/home/saumar/.espressif/python_env/idf6.1_py3.10_env/lib/python3.10/site-packages/pytest_embedded/dut.py:170: in expect_exact
    return self.pexpect_proc.expect_exact(pattern, **kwargs)
/home/saumar/.espressif/python_env/idf6.1_py3.10_env/lib/python3.10/site-packages/pexpect/spawnbase.py:432: in expect_exact
    return exp.expect_loop(timeout)
/home/saumar/.espressif/python_env/idf6.1_py3.10_env/lib/python3.10/site-packages/pexpect/expect.py:181: in expect_loop
    return self.timeout(e)
_ _ _ _ _ _ _ _ _ _ _ _ _ _ _ _ _ _ _ _ _ _ _ _ _ _ _ _ _ _ _ _ _ _ _ _ _ _ _ _ _ _ _ _ _ _ _ _ _ _ _ _ _ _ _ _ _ _ _ _ _ _ _ _ _ _ _ _ _ _ _ _ _ _ _ _ _ _ _ _ _ _ _ _ _ _ _ _ _ _ _ _ _ _ _ _ _ _ _ _ _ _ 

self = <pexpect.expect.Expecter object at 0x70f3cacc38e0>, err = TIMEOUT("<pytest_embedded.log.PexpectProcess object at 0x70f3cacc26e0>\nsearcher: searcher_string:\n    0: b'Ethernet init successful!'")

    def timeout(self, err=None):
        spawn = self.spawn
    
        spawn.before = spawn._before.getvalue()
        spawn.after = TIMEOUT
        index = self.searcher.timeout_index
        if index >= 0:
            spawn.match = TIMEOUT
            spawn.match_index = index
            return index
        else:
            spawn.match = None
            spawn.match_index = None
            msg = str(spawn)
            msg += '\nsearcher: %s' % self.searcher
            if err is not None:
                msg = str(err) + '\n' + msg
    
            exc = TIMEOUT(msg)
            exc.__cause__ = None    # in Python 3.x we can use "raise exc from None"
>           raise exc
E           pexpect.exceptions.TIMEOUT: <pytest_embedded.log.PexpectProcess object at 0x70f3cacc26e0>
E           searcher: searcher_string:
E               0: b'Ethernet init successful!'
E           <pytest_embedded.log.PexpectProcess object at 0x70f3cacc26e0>
E           searcher: searcher_string:
E               0: b'Ethernet init successful!'

/home/saumar/.espressif/python_env/idf6.1_py3.10_env/lib/python3.10/site-packages/pexpect/expect.py:144: TIMEOUT

The above exception was the direct cause of the following exception:

dut = <pytest_embedded.dut.Dut object at 0x70f3cacc3610>, test_pc_nic = '', always_run_all_tests = False

    def ethernet_phy_test(dut: Dut, test_pc_nic: str, always_run_all_tests: bool) -> None:
        """
        Runs the Ethernet PHY tests.
    
        Args:
            dut: DUT object
            test_pc_nic: Name of the test PC Ethernet NIC connected to DUT
            always_run_all_tests: True if all tests should be run, False otherwise
        """
        target_if = EthTestIntf(ETH_TYPE, test_pc_nic)
        try:
>           dut.expect_exact('Ethernet init successful!')

test_eth_phy.py:459: 
_ _ _ _ _ _ _ _ _ _ _ _ _ _ _ _ _ _ _ _ _ _ _ _ _ _ _ _ _ _ _ _ _ _ _ _ _ _ _ _ _ _ _ _ _ _ _ _ _ _ _ _ _ _ _ _ _ _ _ _ _ _ _ _ _ _ _ _ _ _ _ _ _ _ _ _ _ _ _ _ _ _ _ _ _ _ _ _ _ _ _ _ _ _ _ _ _ _ _ _ _ _ 

self = <pytest_embedded.dut.Dut object at 0x70f3cacc3610>, pattern = 'Ethernet init successful!', expect_all = False, not_matching = (), return_what_before_match = False, args = (), kwargs = {}
patterns = ['Ethernet init successful!'], res = []
debug_str = 'Not found "Ethernet init successful!"\nBytes in current buffer (color code eliminated): \nPlease check the full log here: /tmp/pytest-embedded/2026-01-15_15-57-42-834444/test_esp_ethernet[esp32]/dut.log'

    @functools.wraps(func)
    def wrapper(
        self,
        pattern,
        *args,
        expect_all: bool = False,
        not_matching: list[str | re.Pattern] = (),
        return_what_before_match: bool = False,
        **kwargs,
    ) -> Match | AnyStr | list[Match | AnyStr]:
        if return_what_before_match and expect_all:
            raise ValueError('`return_what_before_match` and `expect_all` cannot be `True` at the same time.')
    
        patterns = to_list(pattern)
        res = []
        while patterns:
            try:
                index = func(self, pattern, *args, **kwargs)
            except (pexpect.EOF, pexpect.TIMEOUT) as e:
                debug_str = (
                    f'Not found "{pattern!s}"\n'
                    f'Bytes in current buffer (color code eliminated): {self.pexpect_proc.buffer_debug_str}\n'
                    f'Please check the full log here: {self.logfile}'
                )
>               raise e.__class__(debug_str) from e
E               pexpect.exceptions.TIMEOUT: Not found "Ethernet init successful!"
E               Bytes in current buffer (color code eliminated): 
E               Please check the full log here: /tmp/pytest-embedded/2026-01-15_15-57-42-834444/test_esp_ethernet[esp32]/dut.log

/home/saumar/.espressif/python_env/idf6.1_py3.10_env/lib/python3.10/site-packages/pytest_embedded/dut.py:93: TIMEOUT

The above exception was the direct cause of the following exception:

dut = <pytest_embedded.dut.Dut object at 0x70f3cacc3610>, eth_nic = '', always_run_all_tests = False

    @pytest.mark.parametrize('target', [
        'esp32',
        'esp32p4',
    ], indirect=True)
    def test_esp_ethernet(dut: Dut,
                          eth_nic: str,
                          always_run_all_tests: bool) -> None:
>       ethernet_phy_test(dut, eth_nic, always_run_all_tests)

test_eth_phy.py:577: 
_ _ _ _ _ _ _ _ _ _ _ _ _ _ _ _ _ _ _ _ _ _ _ _ _ _ _ _ _ _ _ _ _ _ _ _ _ _ _ _ _ _ _ _ _ _ _ _ _ _ _ _ _ _ _ _ _ _ _ _ _ _ _ _ _ _ _ _ _ _ _ _ _ _ _ _ _ _ _ _ _ _ _ _ _ _ _ _ _ _ _ _ _ _ _ _ _ _ _ _ _ _ 

dut = <pytest_embedded.dut.Dut object at 0x70f3cacc3610>, test_pc_nic = '', always_run_all_tests = False

    def ethernet_phy_test(dut: Dut, test_pc_nic: str, always_run_all_tests: bool) -> None:
        """
        Runs the Ethernet PHY tests.
    
        Args:
            dut: DUT object
            test_pc_nic: Name of the test PC Ethernet NIC connected to DUT
            always_run_all_tests: True if all tests should be run, False otherwise
        """
        target_if = EthTestIntf(ETH_TYPE, test_pc_nic)
        try:
            dut.expect_exact('Ethernet init successful!')
        except pexpect.exceptions.TIMEOUT as e:
            EthFailMsg.print_eth_init_fail_msg()
>           raise RuntimeError() from e
E           RuntimeError

test_eth_phy.py:462: RuntimeError
------------------------------------------------------------------------------------------- Captured stdout call -------------------------------------------------------------------------------------------
=================================================================================
Ethernet initialization failed!
------------------------------
Check the above DUT log and investigate possible root causes:
1) If EMAC errors:
   a) RMII REF CLK mode incorrectly configured if emac initialization timeouts.
        Does ESP32 outputs the RMII CLK? Or is RMII CLK provided externally by PHY or oscillator?
   b) If external RMII CLK is used, measure the clock signal at ESP32 REF RMII CLK input pin using oscilloscope with sufficient bandwidth. There must be 50 MHz square wave signal.
   c) Make sure programmer/monitor device correctly handles “nDTR”/”nRST” and associated transistors which are connected to GPIO0.
2) If PHY errors:
   a) Check if bootstrap (PHY address) is set correctly or set to "auto" in the code (menuconfig).
   b) Cross-check with schematics if MDIO and MDC GPIOs are correctly configured.
=================================================================================
-------------------------------------------------------------------------------------------- Captured log call ---------------------------------------------------------------------------------------------
INFO     root:test_eth_phy.py:65 detected interfaces: ['br-a93090b6142a', 'docker0', 'virbr0', 'wlp0s20f3', 'enp12s0', 'veth15cae7d', 'br-3cb8c82df7b8', 'lo']
INFO     root:test_eth_phy.py:78 Use enp12s0 for testing
________________________________________________________________________________________ test_esp_ethernet[esp32p4] ________________________________________________________________________________________

self = <pytest_embedded.dut.Dut object at 0x70f3cab744c0>, pattern = 'Ethernet init successful!', expect_all = False, not_matching = (), return_what_before_match = False, args = (), kwargs = {}
patterns = ['Ethernet init successful!'], res = []
debug_str = 'Not found "Ethernet init successful!"\nBytes in current buffer (color code eliminated): \nPlease check the full log here: /tmp/pytest-embedded/2026-01-15_15-57-42-834444/test_esp_ethernet[esp32p4]/dut.log'

    @functools.wraps(func)
    def wrapper(
        self,
        pattern,
        *args,
        expect_all: bool = False,
        not_matching: list[str | re.Pattern] = (),
        return_what_before_match: bool = False,
        **kwargs,
    ) -> Match | AnyStr | list[Match | AnyStr]:
        if return_what_before_match and expect_all:
            raise ValueError('`return_what_before_match` and `expect_all` cannot be `True` at the same time.')
    
        patterns = to_list(pattern)
        res = []
        while patterns:
            try:
>               index = func(self, pattern, *args, **kwargs)

/home/saumar/.espressif/python_env/idf6.1_py3.10_env/lib/python3.10/site-packages/pytest_embedded/dut.py:86: 
_ _ _ _ _ _ _ _ _ _ _ _ _ _ _ _ _ _ _ _ _ _ _ _ _ _ _ _ _ _ _ _ _ _ _ _ _ _ _ _ _ _ _ _ _ _ _ _ _ _ _ _ _ _ _ _ _ _ _ _ _ _ _ _ _ _ _ _ _ _ _ _ _ _ _ _ _ _ _ _ _ _ _ _ _ _ _ _ _ _ _ _ _ _ _ _ _ _ _ _ _ _ 
/home/saumar/.espressif/python_env/idf6.1_py3.10_env/lib/python3.10/site-packages/pytest_embedded/dut.py:170: in expect_exact
    return self.pexpect_proc.expect_exact(pattern, **kwargs)
/home/saumar/.espressif/python_env/idf6.1_py3.10_env/lib/python3.10/site-packages/pexpect/spawnbase.py:432: in expect_exact
    return exp.expect_loop(timeout)
/home/saumar/.espressif/python_env/idf6.1_py3.10_env/lib/python3.10/site-packages/pexpect/expect.py:181: in expect_loop
    return self.timeout(e)
_ _ _ _ _ _ _ _ _ _ _ _ _ _ _ _ _ _ _ _ _ _ _ _ _ _ _ _ _ _ _ _ _ _ _ _ _ _ _ _ _ _ _ _ _ _ _ _ _ _ _ _ _ _ _ _ _ _ _ _ _ _ _ _ _ _ _ _ _ _ _ _ _ _ _ _ _ _ _ _ _ _ _ _ _ _ _ _ _ _ _ _ _ _ _ _ _ _ _ _ _ _ 

self = <pexpect.expect.Expecter object at 0x70f3cab74640>, err = TIMEOUT("<pytest_embedded.log.PexpectProcess object at 0x70f3cab746d0>\nsearcher: searcher_string:\n    0: b'Ethernet init successful!'")

    def timeout(self, err=None):
        spawn = self.spawn
    
        spawn.before = spawn._before.getvalue()
        spawn.after = TIMEOUT
        index = self.searcher.timeout_index
        if index >= 0:
            spawn.match = TIMEOUT
            spawn.match_index = index
            return index
        else:
            spawn.match = None
            spawn.match_index = None
            msg = str(spawn)
            msg += '\nsearcher: %s' % self.searcher
            if err is not None:
                msg = str(err) + '\n' + msg
    
            exc = TIMEOUT(msg)
            exc.__cause__ = None    # in Python 3.x we can use "raise exc from None"
>           raise exc
E           pexpect.exceptions.TIMEOUT: <pytest_embedded.log.PexpectProcess object at 0x70f3cab746d0>
E           searcher: searcher_string:
E               0: b'Ethernet init successful!'
E           <pytest_embedded.log.PexpectProcess object at 0x70f3cab746d0>
E           searcher: searcher_string:
E               0: b'Ethernet init successful!'

/home/saumar/.espressif/python_env/idf6.1_py3.10_env/lib/python3.10/site-packages/pexpect/expect.py:144: TIMEOUT

The above exception was the direct cause of the following exception:

dut = <pytest_embedded.dut.Dut object at 0x70f3cab744c0>, test_pc_nic = '', always_run_all_tests = False

    def ethernet_phy_test(dut: Dut, test_pc_nic: str, always_run_all_tests: bool) -> None:
        """
        Runs the Ethernet PHY tests.
    
        Args:
            dut: DUT object
            test_pc_nic: Name of the test PC Ethernet NIC connected to DUT
            always_run_all_tests: True if all tests should be run, False otherwise
        """
        target_if = EthTestIntf(ETH_TYPE, test_pc_nic)
        try:
>           dut.expect_exact('Ethernet init successful!')

test_eth_phy.py:459: 
_ _ _ _ _ _ _ _ _ _ _ _ _ _ _ _ _ _ _ _ _ _ _ _ _ _ _ _ _ _ _ _ _ _ _ _ _ _ _ _ _ _ _ _ _ _ _ _ _ _ _ _ _ _ _ _ _ _ _ _ _ _ _ _ _ _ _ _ _ _ _ _ _ _ _ _ _ _ _ _ _ _ _ _ _ _ _ _ _ _ _ _ _ _ _ _ _ _ _ _ _ _ 

self = <pytest_embedded.dut.Dut object at 0x70f3cab744c0>, pattern = 'Ethernet init successful!', expect_all = False, not_matching = (), return_what_before_match = False, args = (), kwargs = {}
patterns = ['Ethernet init successful!'], res = []
debug_str = 'Not found "Ethernet init successful!"\nBytes in current buffer (color code eliminated): \nPlease check the full log here: /tmp/pytest-embedded/2026-01-15_15-57-42-834444/test_esp_ethernet[esp32p4]/dut.log'

    @functools.wraps(func)
    def wrapper(
        self,
        pattern,
        *args,
        expect_all: bool = False,
        not_matching: list[str | re.Pattern] = (),
        return_what_before_match: bool = False,
        **kwargs,
    ) -> Match | AnyStr | list[Match | AnyStr]:
        if return_what_before_match and expect_all:
            raise ValueError('`return_what_before_match` and `expect_all` cannot be `True` at the same time.')
    
        patterns = to_list(pattern)
        res = []
        while patterns:
            try:
                index = func(self, pattern, *args, **kwargs)
            except (pexpect.EOF, pexpect.TIMEOUT) as e:
                debug_str = (
                    f'Not found "{pattern!s}"\n'
                    f'Bytes in current buffer (color code eliminated): {self.pexpect_proc.buffer_debug_str}\n'
                    f'Please check the full log here: {self.logfile}'
                )
>               raise e.__class__(debug_str) from e
E               pexpect.exceptions.TIMEOUT: Not found "Ethernet init successful!"
E               Bytes in current buffer (color code eliminated): 
E               Please check the full log here: /tmp/pytest-embedded/2026-01-15_15-57-42-834444/test_esp_ethernet[esp32p4]/dut.log

/home/saumar/.espressif/python_env/idf6.1_py3.10_env/lib/python3.10/site-packages/pytest_embedded/dut.py:93: TIMEOUT

The above exception was the direct cause of the following exception:

dut = <pytest_embedded.dut.Dut object at 0x70f3cab744c0>, eth_nic = '', always_run_all_tests = False

    @pytest.mark.parametrize('target', [
        'esp32',
        'esp32p4',
    ], indirect=True)
    def test_esp_ethernet(dut: Dut,
                          eth_nic: str,
                          always_run_all_tests: bool) -> None:
>       ethernet_phy_test(dut, eth_nic, always_run_all_tests)

test_eth_phy.py:577: 
_ _ _ _ _ _ _ _ _ _ _ _ _ _ _ _ _ _ _ _ _ _ _ _ _ _ _ _ _ _ _ _ _ _ _ _ _ _ _ _ _ _ _ _ _ _ _ _ _ _ _ _ _ _ _ _ _ _ _ _ _ _ _ _ _ _ _ _ _ _ _ _ _ _ _ _ _ _ _ _ _ _ _ _ _ _ _ _ _ _ _ _ _ _ _ _ _ _ _ _ _ _ 

dut = <pytest_embedded.dut.Dut object at 0x70f3cab744c0>, test_pc_nic = '', always_run_all_tests = False

    def ethernet_phy_test(dut: Dut, test_pc_nic: str, always_run_all_tests: bool) -> None:
        """
        Runs the Ethernet PHY tests.
    
        Args:
            dut: DUT object
            test_pc_nic: Name of the test PC Ethernet NIC connected to DUT
            always_run_all_tests: True if all tests should be run, False otherwise
        """
        target_if = EthTestIntf(ETH_TYPE, test_pc_nic)
        try:
            dut.expect_exact('Ethernet init successful!')
        except pexpect.exceptions.TIMEOUT as e:
            EthFailMsg.print_eth_init_fail_msg()
>           raise RuntimeError() from e
E           RuntimeError

test_eth_phy.py:462: RuntimeError
------------------------------------------------------------------------------------------- Captured stdout call -------------------------------------------------------------------------------------------
=================================================================================
Ethernet initialization failed!
------------------------------
Check the above DUT log and investigate possible root causes:
1) If EMAC errors:
   a) RMII REF CLK mode incorrectly configured if emac initialization timeouts.
        Does ESP32 outputs the RMII CLK? Or is RMII CLK provided externally by PHY or oscillator?
   b) If external RMII CLK is used, measure the clock signal at ESP32 REF RMII CLK input pin using oscilloscope with sufficient bandwidth. There must be 50 MHz square wave signal.
   c) Make sure programmer/monitor device correctly handles “nDTR”/”nRST” and associated transistors which are connected to GPIO0.
2) If PHY errors:
   a) Check if bootstrap (PHY address) is set correctly or set to "auto" in the code (menuconfig).
   b) Cross-check with schematics if MDIO and MDC GPIOs are correctly configured.
=================================================================================
-------------------------------------------------------------------------------------------- Captured log call ---------------------------------------------------------------------------------------------
INFO     root:test_eth_phy.py:65 detected interfaces: ['br-a93090b6142a', 'docker0', 'virbr0', 'wlp0s20f3', 'enp12s0', 'veth15cae7d', 'br-3cb8c82df7b8', 'lo']
INFO     root:test_eth_phy.py:78 Use enp12s0 for testing
============================================================================================= warnings summary =============================================================================================
../../../../../.espressif/python_env/idf6.1_py3.10_env/lib/python3.10/site-packages/scapy/layers/ipsec.py:512
  /home/saumar/.espressif/python_env/idf6.1_py3.10_env/lib/python3.10/site-packages/scapy/layers/ipsec.py:512: CryptographyDeprecationWarning: TripleDES has been moved to cryptography.hazmat.decrepit.ciphers.algorithms.TripleDES and will be removed from cryptography.hazmat.primitives.ciphers.algorithms in 48.0.0.
    cipher=algorithms.TripleDES,

../../../../../.espressif/python_env/idf6.1_py3.10_env/lib/python3.10/site-packages/scapy/layers/ipsec.py:516
  /home/saumar/.espressif/python_env/idf6.1_py3.10_env/lib/python3.10/site-packages/scapy/layers/ipsec.py:516: CryptographyDeprecationWarning: TripleDES has been moved to cryptography.hazmat.decrepit.ciphers.algorithms.TripleDES and will be removed from cryptography.hazmat.primitives.ciphers.algorithms in 48.0.0.
    cipher=algorithms.TripleDES,

test_eth_phy.py::test_esp_ethernet[esp32]
test_eth_phy.py::test_esp_ethernet[esp32p4]
  test_eth_phy.py:570: PytestExperimentalApiWarning: record_xml_attribute is an experimental feature
    @pytest.mark.parametrize('target', [

-- Docs: https://docs.pytest.org/en/stable/how-to/capture-warnings.html
========================================================================================= short test summary info ==========================================================================================
FAILED test_eth_phy.py::test_esp_ethernet[esp32] - RuntimeError
FAILED test_eth_phy.py::test_esp_ethernet[esp32p4] - RuntimeError
================================================================================= 2 failed, 4 warnings in 60.32s (0:01:00) =================================================================================
```

**Comment by saumarh** [comment]
The key question is how the same hardware can work on 4.4.8 but not on 5.5.x. If the clock source were incorrect, it wouldn’t work on either version.

**Comment by kostaond** [comment]
If you were able to run the pytest it could narrow down the issue. It runs multiple types of loopbacks so you can see if the problem is PHY or MAC. It even helped me to find out that only RMII Rx path was corrupted due to faulty soldering in past ... Could you please give it one last shot on stable branch like 5.5.2? Your issue is really strange... BTW, what is the source of the RMII CLK in your design?

**Comment by saumarh** [comment]
I could install.sh pytest on v5.5.2. But now my problem is my board/serial adapter. As soon as my new serial adapter that does not always pull IO0 arrives I'll get back to you.

**Comment by kostaond** [comment]
How is your serial adapter connected to the board? Is it via wires? If so, how long are they? Could you please try to flash the board and then **physically disconnect** the adapter and observe if you see any traffic from ESP32 on your PC using `tcpdump` or Wireshark?

**Comment by saumarh** [comment]
@kostaond Please note that, in my board, "Hard resetting via RTS pin..." does nothing.
I need to close a jumper in my adapter, boot in fw download, start pytest, wait for "Hard resetting via RTS pin...", open a jumper in my adapter and reset the board again. This is why you see the boot log a few seconds after "Hard resetting via RTS pin" in logs below.

```
$ pytest --skip-autoflash=y -s --embedded-services esp,idf --tb=no --add-target-as-marker y -m esp32 --eth-nic enp12s0 --port=/dev/ttyUSB0
=========================================================================================== test session starts ============================================================================================
platform linux -- Python 3.10.12, pytest-9.0.2, pluggy-1.6.0
rootdir: /home/saumar/esp/master/esp-idf/esp-eth-drivers/phy_tester
configfile: pytest.ini
plugins: rerunfailures-16.1, ignore-test-results-0.3.0, embedded-1.18.2, timeout-2.4.0
collected 2 items / 1 deselected / 1 selected                                                                                                                                                              

test_eth_phy.py::test_esp_ethernet[esp32] 2026-01-22 14:47:00 Serial port /dev/ttyUSB0
2026-01-22 14:47:00 Connecting.......

---------------------------------------------------------------------------------------------- live log setup ----------------------------------------------------------------------------------------------
INFO     root:serial.py:125 Target: esp32, Port: /dev/ttyUSB0
INFO     root:serial.py:70 Skipping auto flash...
Hard resetting via RTS pin...
---------------------------------------------------------------------------------------------- live log call -----------------------------------------------------------------------------------------------
INFO     root:test_eth_phy.py:65 detected interfaces: ['veth1d24a8d', 'br-3cb8c82df7b8', 'docker0', 'lo', 'br-a93090b6142a', 'enp12s0', 'virbr0', 'wlp0s20f3']
INFO     root:test_eth_phy.py:78 Use enp12s0 for testing
2026-01-22 14:47:12 ets Jul 29 2019 12:21:46
2026-01-22 14:47:12 
2026-01-22 14:47:12 rst:0x1 (POWERON_RESET),boot:0x13 (SPI_FAST_FLASH_BOOT)
2026-01-22 14:47:12 configsip: 0, SPIWP:0xee
2026-01-22 14:47:12 clk_drv:0x00,q_drv:0x00,d_drv:0x00,cs0_drv:0x00,hd_drv:0x00,wp_drv:0x00
2026-01-22 14:47:12 mode:DIO, clock div:2
2026-01-22 14:47:12 load:0x3fff0030,len:6384
2026-01-22 14:47:12 load:0x40078000,len:15916
2026-01-22 14:47:12 load:0x40080400,len:3920
2026-01-22 14:47:12 entry 0x40080644
2026-01-22 14:47:12 I (27) boot: ESP-IDF v5.5.2-dirty 2nd stage bootloader
2026-01-22 14:47:12 I (27) boot: compile time Jan 15 2026 17:27:06
2026-01-22 14:47:12 I (28) boot: Multicore bootloader
2026-01-22 14:47:12 I (29) boot: chip revision: v3.1
2026-01-22 14:47:12 I (32) boot.esp32: SPI Speed      : 40MHz
2026-01-22 14:47:12 I (36) boot.esp32: SPI Mode       : DIO
2026-01-22 14:47:12 I (39) boot.esp32: SPI Flash Size : 2MB
2026-01-22 14:47:12 I (43) boot: Enabling RNG early entropy source...
2026-01-22 14:47:12 I (47) boot: Partition Table:
2026-01-22 14:47:12 I (50) boot: ## Label            Usage          Type ST Offset   Length
2026-01-22 14:47:12 I (56) boot:  0 nvs              WiFi data        01 02 00009000 00006000
2026-01-22 14:47:12 I (63) boot:  1 phy_init         RF data          01 01 0000f000 00001000
2026-01-22 14:47:12 I (69) boot:  2 factory          factory app      00 00 00010000 00100000
2026-01-22 14:47:12 I (76) boot: End of partition table
2026-01-22 14:47:12 I (79) esp_image: segment 0: paddr=00010020 vaddr=3f400020 size=11c14h ( 72724) map
2026-01-22 14:47:12 I (112) esp_image: segment 1: paddr=00021c3c vaddr=3ffb0000 size=02574h (  9588) load
2026-01-22 14:47:12 I (115) esp_image: segment 2: paddr=000241b8 vaddr=40080000 size=0be60h ( 48736) load
2026-01-22 14:47:12 I (135) esp_image: segment 3: paddr=00030020 vaddr=400d0020 size=269d4h (158164) map
2026-01-22 14:47:12 I (189) esp_image: segment 4: paddr=000569fc vaddr=4008be60 size=033dch ( 13276) load
2026-01-22 14:47:13 I (194) esp_image: segment 5: paddr=00059de0 vaddr=50000000 size=00020h (    32) load
2026-01-22 14:47:13 I (202) boot: Loaded app from partition at offset 0x10000
2026-01-22 14:47:13 I (202) boot: Disabling RNG early entropy source...
2026-01-22 14:47:13 I (215) cpu_start: Multicore app
2026-01-22 14:47:13 I (223) cpu_start: GPIO 3 and 1 are used as console UART I/O pins
2026-01-22 14:47:13 I (223) cpu_start: Pro cpu start user code
2026-01-22 14:47:13 I (223) cpu_start: cpu freq: 160000000 Hz
2026-01-22 14:47:13 I (225) app_init: Application information:
2026-01-22 14:47:13 I (229) app_init: Project name:     phy_tester
2026-01-22 14:47:13 I (233) app_init: App version:      lan865x@v0.1.3-4-gb995438
2026-01-22 14:47:13 I (238) app_init: Compile time:     Jan 15 2026 17:27:03
2026-01-22 14:47:13 I (243) app_init: ELF file SHA256:  d3201ad62...
2026-01-22 14:47:13 I (248) app_init: ESP-IDF:          v5.5.2-dirty
2026-01-22 14:47:13 I (252) efuse_init: Min chip rev:     v0.0
2026-01-22 14:47:13 I (256) efuse_init: Max chip rev:     v3.99 
2026-01-22 14:47:13 I (260) efuse_init: Chip rev:         v3.1
2026-01-22 14:47:13 I (264) heap_init: Initializing. RAM available for dynamic allocation:
2026-01-22 14:47:13 I (270) heap_init: At 3FFAE6E0 len 00001920 (6 KiB): DRAM
2026-01-22 14:47:13 I (275) heap_init: At 3FFB2F98 len 0002D068 (180 KiB): DRAM
2026-01-22 14:47:13 I (280) heap_init: At 3FFE0440 len 00003AE0 (14 KiB): D/IRAM
2026-01-22 14:47:13 I (286) heap_init: At 3FFE4350 len 0001BCB0 (111 KiB): D/IRAM
2026-01-22 14:47:13 I (291) heap_init: At 4008F23C len 00010DC4 (67 KiB): IRAM
2026-01-22 14:47:13 I (298) spi_flash: detected chip: generic
2026-01-22 14:47:13 I (300) spi_flash: flash io: dio
2026-01-22 14:47:13 W (303) spi_flash: Detected size(4096k) larger than the size in the binary image header(2048k). Using the size in the binary image header.
2026-01-22 14:47:13 I (316) main_task: Started on CPU0
2026-01-22 14:47:13 I (326) main_task: Calling app_main()
2026-01-22 14:47:13 ^[[0nI (1366) ksz80xx: auto detected phy KSZ8041
2026-01-22 14:47:14 D (1366) esp_eth: new ethernet driver @0x3ffbc920
2026-01-22 14:47:14 I (1366) eth_phy_tester_cmd: Ethernet init successful!
2026-01-22 14:47:14 
2026-01-22 14:47:14  =======================================================
2026-01-22 14:47:14  |          Steps to Test Ethernet PHY                  |
2026-01-22 14:47:14  |                                                      |
2026-01-22 14:47:14  |  1. Enter 'help', check all supported commands       |
2026-01-22 14:47:14  |  2. Connect DUT Ethernet directly to test PC         |
2026-01-22 14:47:14  |  3. Execute any command                              |
2026-01-22 14:47:14  |                                                      |
2026-01-22 14:47:14  =======================================================
2026-01-22 14:47:14 
2026-01-22 14:47:14 
2026-01-22 14:47:14 Type 'help' to get the list of commands.
2026-01-22 14:47:14 Use UP/DOWN arrows to navigate through command history.
2026-01-22 14:47:14 Press TAB when typing command name to auto-complete.
2026-01-22 14:47:14 
2026-01-22 14:47:14 Your terminal application does not support escape sequences.
2026-01-22 14:47:14 
2026-01-22 14:47:14 Line editing and history features are disabled.
2026-01-22 14:47:14 
2026-01-22 14:47:14 On Windows, try using Windows Terminal or Putty instead.
2026-01-22 14:47:14 eth_phy> I (1406) main_task: Returned from app_main()
2026-01-22 14:47:14 loop-server -f 0x3300 -t 2000
2026-01-22 14:47:16 I (3456) ethernet_init: Ethernet(KSZ80XX[23,18]) Started
2026-01-22 14:47:16 D (3456) esp.emac: working in 100Mbps
2026-01-22 14:47:16 D (3456) esp.emac: working in full duplex
2026-01-22 14:47:16 D (3456) esp.emac: Flow control not enabled for the link
2026-01-22 14:47:16 D (3466) esp.emac: emac started
2026-01-22 14:47:16 I (3466) ethernet_init: Ethernet(KSZ80XX[23,18]) Link Up
2026-01-22 14:47:16 I (3466) ethernet_init: Ethernet(KSZ80XX[23,18]) HW Addr 20:43:a8:61:bf:3b
INFO     root:test_eth_phy.py:152 sending test frame
2026-01-22 14:47:18 D (5476) esp.emac: emac stopped
2026-01-22 14:47:18 I (5476) ethernet_init: Ethernet(KSZ80XX[23,18]) Link Down
2026-01-22 14:47:18 I (5476) ethernet_init: Ethernet(KSZ80XX[23,18]) Stopped
2026-01-22 14:47:18 eth_phy> 
2026-01-22 14:47:18 eth_phy> ERROR    root:test_eth_phy.py:160 recv: timed out



loopback server: FAIL
. . . . . . . . . . . . . . . . . . . . . . . . . . . . . . . . . . . . . . . . . . . . .
. DUT                                                                                   .
.                          RMII                             Tr.                         .
.  +------------------+            +---------------+                  +-----------+     .     +---------------+
.  |              +---|            |               |        8|8       |           |     .     |               |
.  |          .-<-| M |-----Rx-----|-----------<---|------- 8|8 ------|           |     .     |               |
.  |   ESP32  |   | A |            |      PHY      |                  |    RJ45   |===========|    Test PC    |
.  |          '->-| C |-----Tx-----|----------->---|------- 8|8 ------|           |     .     |               |
.  |              +---|            |               |        8|8       |           |     .     |               |
.  +------------------+            +---------------+                  +-----------+     .     +---------------+
.                                                                                       .
. . . . . . . . . . . . . . . . . . . . . . . . . . . . . . . . . . . . . . . . . . . . .
INFO     root:test_eth_phy.py:479 Running additional tests to try to isolate the problem...
dummy-tx -s 256 -c 1
2026-01-22 14:47:23 I (10646) ethernet_init: Ethernet(KSZ80XX[23,18]) Started
2026-01-22 14:47:23 D (10646) esp.emac: working in 100Mbps
2026-01-22 14:47:23 D (10646) esp.emac: working in full duplex
2026-01-22 14:47:23 D (10646) esp.emac: Flow control not enabled for the link
2026-01-22 14:47:23 D (10656) esp.emac: emac started
2026-01-22 14:47:23 I (10656) ethernet_init: Ethernet(KSZ80XX[23,18]) Link Up
2026-01-22 14:47:23 I (10656) ethernet_init: Ethernet(KSZ80XX[23,18]) HW Addr 20:43:a8:61:bf:3b
2026-01-22 14:47:23 I (10666) eth_phy_test_fncs: starting ETH broadcast transmissions with Ethertype: 0x3300
2026-01-22 14:47:24 D (11666) esp.emac: emac stopped
2026-01-22 14:47:24 I (11666) ethernet_init: Ethernet(KSZ80XX[23,18]) Link Down
2026-01-22 14:47:24 I (11666) ethernet_init: Ethernet(KSZ80XX[23,18]) Stopped
2026-01-22 14:47:24 eth_phy> 
2026-01-22 14:47:24 eth_phy> ERROR    root:test_eth_phy.py:372 recv: timed out
loop-server -v -f 0x3300 -t 2000
2026-01-22 14:47:30 I (17716) ethernet_init: Ethernet(KSZ80XX[23,18]) Started
2026-01-22 14:47:30 D (17716) esp.emac: working in 100Mbps
2026-01-22 14:47:30 D (17716) esp.emac: working in full duplex
2026-01-22 14:47:30 D (17716) esp.emac: Flow control not enabled for the link
2026-01-22 14:47:30 D (17726) esp.emac: emac started
2026-01-22 14:47:30 I (17726) ethernet_init: Ethernet(KSZ80XX[23,18]) Link Up
2026-01-22 14:47:30 I (17726) ethernet_init: Ethernet(KSZ80XX[23,18]) HW Addr 20:43:a8:61:bf:3b
2026-01-22 14:47:32 D (19736) esp.emac: emac stopped
2026-01-22 14:47:32 I (19736) ethernet_init: Ethernet(KSZ80XX[23,18]) Link Down
2026-01-22 14:47:32 I (19736) ethernet_init: Ethernet(KSZ80XX[23,18]) Stopped
2026-01-22 14:47:32 eth_phy> 
2026-01-22 14:47:32 eth_phy> ERROR    root:test_eth_phy.py:327 expected frame was not received by DUT
farend-loop-en -e
2026-01-22 14:47:36 I (24006) ethernet_init: Ethernet(KSZ80XX[23,18]) Started
2026-01-22 14:47:36 D (24006) esp.emac: working in 100Mbps
2026-01-22 14:47:36 D (24006) esp.emac: working in full duplex
2026-01-22 14:47:36 D (24006) esp.emac: Flow control not enabled for the link
2026-01-22 14:47:36 D (24016) esp.emac: emac started
2026-01-22 14:47:36 I (24016) ethernet_init: Ethernet(KSZ80XX[23,18]) Link Up
2026-01-22 14:47:36 I (24016) ethernet_init: Ethernet(KSZ80XX[23,18]) HW Addr 20:43:a8:61:bf:3b
2026-01-22 14:47:36 eth_phy> 
2026-01-22 14:47:36 eth_phy> INFO     root:test_eth_phy.py:152 sending test frame
INFO     root:test_eth_phy.py:165 test frame received
farend-loop-en -d
2026-01-22 14:47:36 D (24086) esp.emac: emac stopped
2026-01-22 14:47:36 I (24086) ethernet_init: Ethernet(KSZ80XX[23,18]) Link Down
2026-01-22 14:47:36 I (24096) ethernet_init: Ethernet(KSZ80XX[23,18]) Stopped
2026-01-22 14:47:36 eth_phy> 
2026-01-22 14:47:36 eth_phy> loop-test -s 640 -c 5
2026-01-22 14:47:38 I (25876) ethernet_init: Ethernet(KSZ80XX[23,18]) Started
2026-01-22 14:47:38 D (25876) esp.emac: working in 100Mbps
2026-01-22 14:47:38 D (25876) esp.emac: working in full duplex
2026-01-22 14:47:38 D (25876) esp.emac: Flow control not enabled for the link
2026-01-22 14:47:38 D (25886) esp.emac: emac started
2026-01-22 14:47:38 I (25886) ethernet_init: Ethernet(KSZ80XX[23,18]) Link Up
2026-01-22 14:47:38 I (25886) ethernet_init: Ethernet(KSZ80XX[23,18]) HW Addr 20:43:a8:61:bf:3b
2026-01-22 14:47:38 I (25896) eth_phy_test_fncs: starting ETH broadcast transmissions with Ethertype: 0x3300
2026-01-22 14:47:44 I (32016) eth_phy_test_fncs: TXed frames: 5, looped frames: 0, RX errors: 0
2026-01-22 14:47:44 D (32016) esp.emac: emac stopped
2026-01-22 14:47:44 I (32016) ethernet_init: Ethernet(KSZ80XX[23,18]) Link Down
2026-01-22 14:47:44 I (32026) ethernet_init: Ethernet(KSZ80XX[23,18]) Stopped
2026-01-22 14:47:44 eth_phy> 
2026-01-22 14:47:44 eth_phy> ERROR    root:test_eth_phy.py:292 near-end loop back failed



DUT tx: FAIL
DUT rx: FAIL
. . . . . . . . . . . . . . . . . . . . . . . . . . . . . . . . . . . . . . . . . . . . .
. DUT                                                                                   .
.                          RMII                             Tr.                         .
.  +------------------+            +---------------+                  +-----------+     .     +---------------+
.  |              +---|            |               |        8|8       |           |     .     |               |
.  |              | M |-----Rx-----|-----------<---|------- 8|8 ------|           |     .     |               |
.  |   ESP32      | A |            |      PHY      |                  |    RJ45   |===========|    Test PC    |
.  |              | C |-----Tx-----|----------->---|------- 8|8 ------|           |     .     |               |
.  |              +---|            |               |        8|8       |           |     .     |               |
.  +------------------+            +---------------+                  +-----------+     .     +---------------+
.                                                                                       .
. . . . . . . . . . . . . . . . . . . . . . . . . . . . . . . . . . . . . . . . . . . . .



Near-end loopback: FAIL
Far-end loopback: PASS
. . . . . . . . . . . . . . . . . . . . . . . . . . . . . . . . . . . . . . . . . . . . .
. DUT                                                                                   .
.                          RMII                             Tr.                         .
.  +------------------+            +---------------+                  +-----------+     .     +---------------+
.  |              +---|            |               |        8|8       |           |     .     |               |
.  |              | M |-----Rx-----|-<-.       .-<-|------- 8|8 ------|           |     .     |               |
.  |   ESP32      | A |            |   |  PHY  |   |                  |    RJ45   |===========|    Test PC    |
.  |              | C |-----Tx-----|->-'       '->-|------- 8|8 ------|           |     .     |               |
.  |              +---|            |               |        8|8       |           |     .     |               |
.  +------------------+            +---------------+                  +-----------+     .     +---------------+
.                                                                                       .
.                    (near-end loopback)         (far-end loopback)                     .
. . . . . . . . . . . . . . . . . . . . . . . . . . . . . . . . . . . . . . . . . . . . .



==============================
Final problem isolation
==============================
. . . . . . . . . . . . . . . . . . . . . . . . . . . . . . . . . . . . . . . . . . . . .
. DUT                                                                                   .
.                          RMII                             Tr.                         .
.  +------------------+            +---------------+                  +-----------+     .     +---------------+
.  |              +---|            |               |        8|8       |           |     .     |               |
.  |              | M |-----Rx-----|-<-.       .-<-|------- 8|8 ------|           |     .     |               |
.  |   ESP32      | A |            |   |  PHY  |   |                  |    RJ45   |===========|    Test PC    |
.  |              | C |-----Tx-----|->-'       '->-|------- 8|8 ------|           |     .     |               |
.  |              +---|            |               |        8|8       |           |     .     |               |
.  +------------------+            +---------------+                  +-----------+     .     +---------------+
.                                                                                       .
.                    (near-end loopback)         (far-end loopback)                     .
. . . . . . . . . . . . . . . . . . . . . . . . . . . . . . . . . . . . . . . . . . . . .
=================================================================================
The RMII data pane non functional!
----------------------------------
The DUT is not able to receive and transmit Ethernet frames. The issue needs to be probed on the board.
* Identify location of RXD[0,1] and TXD[0,1] pins on your board at ESP32 side and at PHY side.
* Go over all identified pins. Connect the first oscilloscope probe at the ESP32 pin side and the other probe at PHY side (expect signal with frequency of 25 MHz when in 100mbps mode).

-- Transmit path steps: --
  * Flash `phy_tester` tool to DUT and connect to it using `monitor`
  * Run `dummy-tx` command in DUT console. Appropriately configure the interval and number of transmission so you have enough time to perform measurement.
  * The DUT now transmits frames and you should see the same signal at both ESP32 and PHY sides. If you do not see it at PHY side, the trace is corrupted. It could be missing or having incorrect value of series termination resistor or incorrect tracing.
  * If signal at TXD[0,1] is OK, check TX_EN signal path.

-- Receive path steps: --
  * Run `python pytest_eth_phy.py --eth_nic=NIC_NAME dummy-tx` command in test PC console. Appropriately configure the interval and number of transmission so you have enough time to perform measurement.
  * The Test PC now transmits frames and you should see the same signal at both PHY and ESP32 sides. If you do not see it at ESP32 side, the trace is corrupted. It could be missing or having incorrect value of series termination resistor or incorrect tracing.
Since both receive and transmit is not possible, check also CRS_DV signal path if data signals look good.
=================================================================================

The test finished! `Final problem isolation` should show you the most probable location of issue. However, go over the full log to see additional details and to fully understand each tested scenario.

Script run:
PASSED

============================================================================================= warnings summary =============================================================================================
../../../../../.espressif/python_env/idf5.5_py3.10_env/lib/python3.10/site-packages/scapy/layers/ipsec.py:512
  /home/saumar/.espressif/python_env/idf5.5_py3.10_env/lib/python3.10/site-packages/scapy/layers/ipsec.py:512: CryptographyDeprecationWarning: TripleDES has been moved to cryptography.hazmat.decrepit.ciphers.algorithms.TripleDES and will be removed from cryptography.hazmat.primitives.ciphers.algorithms in 48.0.0.
    cipher=algorithms.TripleDES,

../../../../../.espressif/python_env/idf5.5_py3.10_env/lib/python3.10/site-packages/scapy/layers/ipsec.py:516
  /home/saumar/.espressif/python_env/idf5.5_py3.10_env/lib/python3.10/site-packages/scapy/layers/ipsec.py:516: CryptographyDeprecationWarning: TripleDES has been moved to cryptography.hazmat.decrepit.ciphers.algorithms.TripleDES and will be removed from cryptography.hazmat.primitives.ciphers.algorithms in 48.0.0.
    cipher=algorithms.TripleDES,

test_eth_phy.py::test_esp_ethernet[esp32]
  test_eth_phy.py:570: PytestExperimentalApiWarning: record_xml_attribute is an experimental feature
    @pytest.mark.parametrize('target', [

-- Docs: https://docs.pytest.org/en/stable/how-to/capture-warnings.html
=============================================================================== 1 passed, 1 deselected, 3 warnings in 48.07s ===============================================================================
```

**Comment by kostaond** [comment]
It's deaf in both ways between MAC and PHY. PHY to PC path is OK. Yet it works with IDFv4.4. Well, I can officially claim it's the strangest issue I've ever seen... Could you please share the following information:
* detailed HW description (schematics ideally)
* complete `basic` example sdkconfig

**Comment by kostaond** [comment]
Hi @saumarh, just checking in on this issue. Do you have any updates or additional information that could help us move this forward?

**Comment by saumarh** [comment]
Hi @kostaond please keep this thread open. The basic example SDK Config is in the first message of this thread. I still need to provide you the schematics requested.

**Comment by marcelo-richter-mercato** [comment]
Schematics:

<img width="1108" height="568" alt="Image" src="https://github.com/user-attachments/assets/313ddeb8-2b9f-4ea1-887f-7d27b6d88803" />

and 

<img width="903" height="421" alt="Image" src="https://github.com/user-attachments/assets/54504774-db97-4466-bfbe-1992f5e4c4d2" />

**Comment by kostaond** [comment]
@saumarh I'll check the schematic. Could you please answer my previous question regarding the serial adapter? The point is that I observed issues in past when serial programmer was connected via long wire or improper PCB traces associated with GPIO0. REF RMII is 50 MHz and signal integrity is an concern.

>How is your serial adapter connected to the board? Is it via wires? If so, how long are they? Could you please try to flash the board and then physically disconnect the adapter and observe if you see any traffic from ESP32 on your PC using tcpdump or Wireshark?

**Comment by kostaond** [comment]
Closing the issue as we are not able to reproduce locally... One final thought, do you set/use EMAC GPIO in your application prior Ethernet initialization? 

Feel free to re-open if you find new clues related to the issue.
